word,sentence1,sentence2,sentence3,sentence4,sentence5,option_result
succinct,"Sure, here is a paragraph with the word 'succinct' used in five sentences: Having a succinct communication style is essential in conveying information clearly and concisely",Being able to provide succinct responses in meetings shows professionalism and effective time management,A succinct summary of the report highlighted the key findings for the team,"The professor's lectures were always succinct, making the complex topics easier to understand",It is important for writers to be able to convey their ideas in a succinct manner to keep readers engaged.,"['succinct', 'decorous', 'polarise', 'futile', 'extrovert', 0]"
perfidy,His perfidy knew no bounds as he deceived his closest friends with lies and manipulation,The perfidy of the corrupt politician was exposed when evidence of bribery emerged,She felt a sense of betrayal from her colleague's perfidy in spreading rumors about her,The company's downfall was due to the CEO's perfidy in embezzling funds for personal gain,"Despite his charming demeanor, his perfidy soon became apparent to those who were once deceived by his facade.","['injunction,', 'malign,', 'infinitesimal,', 'maladroit', 'perfidy', 4]"
"utopia,","In the fiction novel I recently read, the protagonist stumbled upon a hidden utopia where peace and harmony reigned supreme","The utopia was described as a flawless society free from suffering or inequality, where everyone lived in perfect symbiosis","The author painted a vivid picture of this utopia, illustrating a world untouched by corruption or greed","The utopia existed in stark contrast to the dystopian reality outside its borders, serving as a beacon of hope and inspiration","Despite its idyllic nature, the utopia faced its own set of challenges and dilemmas, making it an intriguing setting for the story.","['recant', 'discrete', 'vindicate', 'static,', 'utopia,', 4]"
dissolution,The dissolution of the company was inevitable due to financial mismanagement,Legal proceedings were initiated following the dissolution of their business partnership,The dissolution of their marriage was a difficult process for both parties involved,The dissolution of the organization led to the loss of many jobs in the community,The dissolution of the contract was finalized after months of negotiations.,"['dissolution', 'martyr', 'languish', 'equivocal', 'unctuous', 0]"
succumb,"As the relentless storm approached, the old tree began to show signs of weakness, its branches starting to succumb to the strong winds","Despite its best efforts to resist, the tree eventually succumbed to the force of nature and fell with a loud crash","The house nearby also began to succumb to the fury of the storm, its windows shattering under the pressure",The residents inside knew they could not hold out for much longer as their home started to succumb to the power of the elements,"In the aftermath, it was clear that nothing could have prevented the destruction caused by the storm, as even the sturdiest structures succumbed to its might.","['doctrinaire', 'succumb', 'dissolution', 'revere', 'conventional', 1]"
coalesce,The diverse ideas presented during the meeting began to coalesce into a coherent plan for the upcoming project,"As the team members continued to discuss and brainstorm, their individual perspectives started to coalesce into a unified vision",It was fascinating to watch the different concepts gradually coalesce into a comprehensive strategy that addressed all aspects of the problem,The merging of various opinions and approaches allowed for a coalescence of innovative solutions that impressed everyone in the room,"Ultimately, the collaborative effort led to a coalescence of creativity and expertise that set the stage for success.","['decorous', 'inert', 'figurative', 'coalesce', 'harbinger', 3]"
broach,She decided to broach the topic of their upcoming vacation during dinner with her family,"As she carefully broached the subject, she could sense that her parents were intrigued","With a hesitant smile, she broached the idea of traveling to Europe instead of their usual beach destination","It was a difficult conversation to broach, but she felt relieved once everything was out in the open",Broaching the topic ultimately led to an exciting and spirited discussion among her family.,"['languish', 'sobriety', 'epitome', 'awry', 'broach', 4]"
unctuous,"Her unctuous smile seemed insincere as she greeted the guests at the party, her words dripping with false compliments","He relied on his unctuous charm to win over clients, smoothly persuading them with persuasive rhetoric","The politician's unctuous mannerisms left a sour taste in the mouths of voters, who saw through his deceptive facade","The slimy, unctuous texture of the dish was unappealing to those with more refined culinary tastes","Despite his unctuous behavior, he failed to gain the trust of his colleagues who saw him as disingenuous.","['unctuous', 'incisive', 'malign,', 'respite,', 'infinitesimal,', 0]"
gravity,"The force of gravity is responsible for keeping us grounded on Earth, pulling all objects towards the center of the planet",Gravity is what keeps the planets in orbit around the sun and holds the galaxies together in the vast expanse of space,"Without gravity, we would float aimlessly in space, unable to maintain stability or direction","The concept of gravity was famously described by Sir Isaac Newton in his theory of universal gravitation, revolutionizing our understanding of the physical world",Understanding gravity is essential for space exploration and the study of celestial bodies in our universe.,"['gravity', 'fatuous', 'vocation,', 'martyr', 'sobriety', 0]"
mendicant,"The mendicant monk walked barefoot through the bustling marketplace, his tattered robes billowing in the wind","As a mendicant, he relied on the generosity of passersby for his sustenance, often receiving alms in the form of food or coins","Despite his humble appearance, the mendicant exuded a sense of peace and contentment, his eyes reflecting a deep inner wisdom","Many people were drawn to the mendicant's presence, seeking advice and solace in his calm demeanor","In the midst of the chaos of the city, the mendicant remained a beacon of serenity and simplicity, embodying the essence of spiritual detachment.","['evanescent', 'amenity', 'mendicant', 'gravity', 'elliptical,', 2]"
"agnostic,",Agnosticism is a philosophical viewpoint that asserts the existence of God is unknown or unknowable,Agnostics do not claim to have definitive knowledge or belief in a higher power,The agnostic position is often characterized by skepticism towards religious claims,Many agnostics are open to the idea of spiritual exploration without committing to a specific religious doctrine,"Overall, agnosticism encourages critical thinking and questioning in the search for understanding about the nature of existence.","['inept', 'agnostic,', 'wistful', 'apocalypse', 'coalesce', 1]"
"elliptical,",The elliptical shape of the moon was visible through the clear night sky,She preferred using an elliptical machine over running on a treadmill at the gym,The scientist studied the orbit of the planets and described them as elliptical paths around the sun,The artist sketched an abstract painting with an elliptical design in shades of blue and green,The architect designed a modern building with an elliptical floor plan that maximized natural light and space.,"['edify,', 'pristine', 'hegemony', 'elliptical,', 'imminent', 3]"
fatuous,"His fatuous behavior during the meeting drew raised eyebrows from his colleagues, who were baffled by his nonsensical comments","Despite being well-educated, he often made fatuous remarks that left others questioning his intelligence",The fatuous decision to invest in a failing company ultimately led to his financial downfall,It was evident that his fatuous demeanor was a mask for his insecurities and lack of confidence,"Despite being warned about the potential consequences, he continued to make fatuous decisions without considering the long-term implications.","['recant', 'vocation,', 'perfidy', 'fatuous', 'magnate', 3]"
contentious,"The contentious debate over the new policy took center stage at the board meeting, with strong opinions on both sides",Tensions rose as committee members engaged in a contentious discussion about the budget allocation for the upcoming fiscal year,The contentious issue of resource distribution in the workplace sparked heated conversations among employees,"Despite efforts to find common ground, the contentious negotiations between the two parties seemed to reach a stalemate","The contentious nature of the topic made it difficult for consensus to be reached, leading to further delays in decision-making.","['awry', 'coalesce', 'contentious', 'broach', 'fatuous', 2]"
inept,His inept handling of the situation was evident to everyone in the room as he fumbled with the presentation slides,"Despite his efforts to appear confident, his ineptitude was glaringly obvious, causing a few stifled chuckles from the audience","It was apparent that he was out of his depth, struggling to articulate his points clearly and coherently","The tension in the room grew as his ineptitude became more pronounced, leading to an awkward silence",The meeting concluded with a sense of disappointment at the inept manner in which the information was delivered.,"['impetuous', 'infinitesimal,', 'mendicant', 'inept', 'empirical', 3]"
proliferate,"The invasive species began to proliferate rapidly in the once untouched ecosystem, causing significant disruption to the native flora and fauna","Despite efforts to control its spread, the plant continued to proliferate, dominating large areas of the landscape","The internet allowed misinformation to proliferate unchecked, leading to confusion and doubt among the public","As social media platforms grew in popularity, fake news stories began to proliferate at an alarming rate, impacting public discourse","The lack of regulation allowed counterfeit products to proliferate in the market, deceiving unsuspecting consumers.","['proliferate', 'decorous', 'static,', 'figurative', 'perfidy', 0]"
wistful,"As she watched the golden sunset, a wistful expression crossed her face, reminiscing about the carefree days of her youth",The sound of the gentle breeze through the trees evoked a wistful feeling of longing for a time long past,The old photographs on the mantel filled her with a wistful nostalgia for the happy moments captured in time,"The distant sound of a familiar song playing brought a wistful smile to her lips, transporting her back to cherished memories","Despite the passage of time, the wistful yearning for the simplicity of days gone by lingered in her heart.","['doctrinaire', 'inert', 'agnostic,', 'quixotic', 'wistful', 4]"
callow,"The callow youth had a naive outlook on life, believing everything was black and white","His callow behavior often irked those around him, as he lacked the depth of experience to understand complex situations","Despite his callow nature, there was a certain charm in his innocence and earnestness","His callow attempts at flirting were endearing, yet also slightly awkward","Over time, he would mature and move past his callow ways, gaining wisdom and understanding.","['inept', 'extrovert', 'recant', 'effusion', 'callow', 4]"
evanescent,"The evanescent beauty of the sunset painted the sky in vibrant hues of pink and orange, casting a fleeting spell over the horizon","As the waves gently lapped against the shore, the seagulls soared gracefully in the evanescent light of dusk","The delicate petals of the cherry blossoms fell to the ground, a reminder of the evanescent nature of spring","Memories intertwined with dreams in an evanescent dance, leaving a bittersweet feeling in its wake","Time seemed to unravel in an evanescent moment, where reality blurred with fantasy, creating a surreal cascade of emotions.","['evanescent', 'abate', 'quixotic', 'futile', 'injunction,', 0]"
eminent,Scholars regard Dr,"Smith as an eminent authority in the field of psychology, known for conducting groundbreaking research in cognitive development",Her eminently innovative approach to the study of emotions has garnered widespread acclaim from her peers,Dr,Smith's eminent contributions to the field have been recognized with numerous prestigious awards and accolades,"['eminent', 'languish', 'inept', 'protagonist,', 'gratuitous', 0]"
"injunction,",The court issued a temporary injunction prohibiting the company from selling the patented product,The plaintiff's attorney argued that an injunction was necessary to prevent further harm,Compliance with the court's injunction was required for the company to avoid legal consequences,The injunction was seen as a necessary measure to protect the interests of both parties involved in the dispute,Violating the terms of the injunction could result in severe penalties for the company.,"['profess,', 'protract', 'injunction,', 'injunction,', 'doctrinaire', 2]"
decorous,The decorous guests arrived at the elegant ball wearing their finest attire,The hostess ensured that everything was arranged in a decorous manner to create a sophisticated ambiance,The decorous music played softly in the background as the guests mingled and socialized,The decorous behavior of the attendees set the tone for a refined and civilized evening,"Overall, it was a decorous affair that left a lasting impression on all who attended.","['decorous', 'wistful', 'vocation,', 'malinger', 'vindicate', 0]"
"infinitesimal,","The scientist used a microscope to examine the infinitesimal particles in the sample, revealing intricate details invisible to the naked eye",Even the smallest changes at an infinitesimal level can have a significant impact on the overall system,"In mathematics, an infinitesimal is a quantity that is smaller than any finite quantity but still greater than zero","The artist paid great attention to detail, creating a painting with infinitesimal brushstrokes that added depth and texture",Understanding the infinitesimal differences between various species can lead to breakthroughs in evolutionary biology.,"['equivocal', 'injunction,', 'profess,', 'futile', 'infinitesimal,', 4]"
amenity,"The luxury resort offers a wide range of amenities, including a spa, tennis courts, and a swimming pool",Each room is equipped with modern amenities such as a minibar and a flat-screen TV,Guests can enjoy the amenities of the hotel's fitness center to stay active during their stay,The resort's amenities also include a restaurant serving delicious meals and a 24-hour concierge service,"With so many amenities available, guests can truly relax and indulge in their vacation experience.","['empirical', 'antecedent', 'amenity', 'extrovert', 'inert', 2]"
harbinger,The sudden drop in temperature was seen as a harbinger of the upcoming winter season,Dark clouds gathering in the sky served as a harbinger of the impending storm,The sound of distant thunder acted as a harbinger of the approaching bad weather,The first snowfall of the year was often considered a harbinger of the holiday season,The blooming of cherry blossoms in spring was seen as a harbinger of new beginnings and growth.,"['harbinger', 'prerogative', 'extrovert', 'wistful', 'infinitesimal,', 0]"
futile,"It is futile to continue arguing with him, as he refuses to listen to reason","Their attempts to fix the broken machine were futile, as it was beyond repair",The detective's futile search for evidence left him feeling frustrated and defeated,"She sighed in frustration, realizing that her efforts to change his mind were futile","Despite their best efforts, the team's futile attempts to catch up with the competition resulted in a disappointing loss.","['impetuous', 'pristine', 'relinquish', 'futile', 'incisive', 3]"
epitome,The fashion model was the epitome of elegance and grace as she walked down the runway in a stunning evening gown,His charming personality and wit made him the epitome of a perfect gentleman in the eyes of everyone who knew him,"The historic castle stood as the epitome of medieval architecture, with its towering stone walls and intricate carvings",The singer's powerful voice and emotional delivery were considered the epitome of soulful music by critics and fans alike,"The luxury sports car was the epitome of speed and style, turning heads everywhere it went with its sleek design and roaring engine.","['decorous', 'imminent', 'paradigm', 'epitome', 'vindicate', 3]"
manifesto,A manifesto is a bold declaration of beliefs and intentions that serves as a guiding principle for a group or individual,"Throughout history, influential leaders have used manifestos to outline their vision and call others to action",The manifesto of a political party often highlights its core values and policy goals for the future,Artists and creatives also sometimes write manifestos to articulate their artistic philosophy and challenge traditional norms,"By crafting a manifesto, one can clarify their purpose and inspire others to join them in their mission.","['empirical', 'paradigm', 'bereaved', 'imminent', 'manifesto', 4]"
"edify,","As an intelligent assistant, I understand that the word 'edify' means to instruct or improve someone morally or intellectually",Reading books can edify the mind and broaden one's perspectives on various subjects,Attending educational seminars and workshops can also edify individuals by providing them with new knowledge and skills,Engaging in thoughtful discussions with others can further edify one's understanding of different viewpoints,It is important to seek out opportunities for personal growth and edification to continuously develop oneself.,"['edify,', 'malign,', 'agnostic,', 'egalitarian', 'empirical', 0]"
polarise,"The controversial decision to build a new highway through the pristine forest has polarised the community, with environmentalists strongly opposed to the project while local businesses welcome the potential for increased tourism","The issue has polarised friendships, with heated debates causing rifts between once-close friends who now find themselves on opposite sides of the argument","The divisive nature of the debate has even polarised families, with dinner table conversations turning into arguments over the benefits versus the drawbacks of the proposed development","Social media has amplified the polarisation, with individuals retreating into echo chambers where their views are reinforced rather than challenged, leading to further division in the community","Despite efforts to find common ground, the issue continues to polarise opinions, highlighting the complexities of balancing economic growth with environmental conservation.","['broach', 'prerogative', 'proliferate', 'polarise', 'wistful', 3]"
capitulate,"Despite the overwhelming pressure, he refused to capitulate to the demands of his rivals",The enemy army made it clear that they would only accept their terms if the king chose to capitulate,The negotiation seemed to be at a standstill as neither side was willing to capitulate on their key points,The general's refusal to capitulate in the face of defeat earned him respect among his troops,"In the end, it was the enemy who chose to capitulate, bringing an unexpected conclusion to the conflict.","['egalitarian', 'paradigm', 'gravity', 'capitulate', 'fatuous', 3]"
impetuous,"Known for his impetuous nature, Alex often made rash decisions without considering the consequences","His impetuous behavior led him to buy an expensive sports car on a whim, leaving his friends astonished","Despite his impulsive tendencies, Alex's impetuous actions sometimes brought excitement and spontaneity into their lives","However, his impetuous decisions had a habit of landing him in trouble, forcing him to learn from his mistakes","Ultimately, Alex realized that tempering his impetuous impulses with careful consideration was the key to avoiding unnecessary complications in his life.","['sobriety', 'discrete', 'impetuous', 'quixotic', 'imminent', 2]"
magnate,"The business magnate invested in several industries, expanding his empire across various sectors","As a philanthropic magnate, he donated generously to charitable organizations and community projects","Known for his keen business acumen, the magnate successfully navigated complex deals and partnerships",The media often covered the magnate's lavish lifestyle and opulent residences,"Despite his wealth and power, the magnate remained humble and connected with employees at all levels of his company.","['maladroit', 'static,', 'elliptical,', 'magnate', 'revere', 3]"
figurative,"In poetry, figurative language is often used to create vivid imagery and convey deeper meanings",Writers utilize figurative expressions like similes and metaphors to add layers of complexity to their writing,"By employing figurative devices, authors can evoke emotions and stimulate the reader's imagination","Figurative language allows for a more nuanced and nuanced understanding of the text, enabling readers to interpret the work in various ways","Through the use of figurative language, writers can paint a rich tapestry of words that resonate with readers on a profound level.","['figurative', 'malign,', 'transgress', 'apocalypse', 'extrovert', 0]"
bereaved,"After the tragic accident, the bereaved families gathered at the memorial service to mourn their lost loved ones",The community came together to offer support and comfort to the bereaved parents and siblings,The bereaved widow found solace in the memories shared by friends and family,The bereaved children struggled to come to terms with the sudden loss of their father,"Despite their grief, the bereaved families found strength in each other during this difficult time.","['extrovert', 'succinct', 'profess,', 'bereaved', 'proliferate', 3]"
abate,"Despite the initial intensity of the storm, the heavy rain began to abate as the clouds slowly dispersed, allowing rays of sunlight to filter through","The fierce winds that had been battering the trees all night finally started to abate, bringing a sense of calm to the once turbulent landscape","Residents welcomed the news that the floodwaters were beginning to abate, signaling the start of the recovery process for their community","The medication helped abate the pain the patient was experiencing, providing some much-needed relief","As the negotiations progressed, tensions between the two parties began to abate, leading to a more productive discussion.","['acute', 'apocalypse', 'malign,', 'protagonist,', 'abate', 4]"
tenuous,"The relationship between the two countries was tenuous, with tensions simmering just beneath the surface",The fragile ceasefire agreement provided only a tenuous hope for lasting peace in the region,His tenuous grasp on reality made it difficult for others to trust his judgment,The delicate balance of power in the region was maintained by a tenuous agreement among the warring factions,"She felt a tenuous connection to the ancient ruins, as if the whispers of the past were calling out to her.","['vehement', 'conventional', 'awry', 'abate', 'tenuous', 4]"
proximity,She felt a sense of comfort in the proximity of her loved ones,The close proximity of the restaurant to her office made it a convenient lunch spot,The proximity of the thunderstorm made her anxious about the impending rainfall,Living in close proximity to nature allowed her to appreciate the beauty of the surroundings,The close proximity of the two rival companies led to increased competition in the market.,"['proliferate', 'gratuitous', 'relinquish', 'proximity', 'appropriate,', 3]"
inert,"The rock sat inert on the ground, unmoved by the bustling activity around it",Its inert state made it seem almost forgotten in the vast landscape,"Despite its inert appearance, it held centuries-old secrets within its core","The once mighty river now flowed around the inert boulder, bypassing it as if it were insignificant","Gradually, time eroded the inert rock, reshaping it into a smooth, unrecognizable form.","['callow', 'antecedent', 'futile', 'inert', 'incisive', 3]"
protract,"""Let us not protract this discussion any longer,"" he said with a sigh",She decided to protract the meeting in order to address all concerns thoroughly,"Despite his efforts to protract the negotiation process, they reached an agreement quicker than expected",The project timeline had to be protracted due to unforeseen delays in procurement,It's better to protract the decision-making process to ensure all options are carefully considered.,"['relinquish', 'incisive', 'protract', 'acute', 'gratuitous', 2]"
gratuitous,"The film was criticized for its gratuitous violence, with many viewers finding it unnecessary and off-putting",Some felt that the use of gratuitous profanity detracted from the overall quality of the dialogue,The director's decision to include a gratuitous love scene seemed out of place and forced,Critics argued that the product placement in the movie was gratuitous and distracting,"Despite receiving mixed reviews, some audiences appreciated the film's gratuitous use of special effects.","['gratuitous', 'irrevocable', 'recant', 'viable', 'equivocal', 0]"
