word,sentence1,sentence2,sentence3,sentence4,sentence5,option_result
doyen,"The doyen of the culinary world, Chef Julia, was celebrated for her innovative cooking techniques and unique flavor combinations","As the doyen of the fashion industry, her designs were always ahead of their time, setting trends that others could only aspire to follow","The doyen of classical music, Maestro Rodriguez, captivated audiences with his masterful interpretations and virtuosic performances","In the world of literature, the doyen of novelists, Author Smith, was known for her vivid storytelling and compelling characters","As the doyen of investigative journalism, Reporter Johnson fearlessly pursued the truth, uncovering corruption and holding the powerful accountable.","['abdicate', 'imperious', 'doyen', 'inch', 'matriculate', 2]"
imperious,"Her imperious demeanor commanded attention wherever she went, making it clear that she was accustomed to being in charge","With an imperious gaze, she surveyed the room, silently assessing the situation before asserting her authority","Her imperious tone brooked no opposition, leaving those around her feeling compelled to comply with her directives","Every movement she made seemed imbued with an imperious grace, a reminder of her regal bearing","Despite her imperious behavior, there was an undeniable allure to her commanding presence that drew others to her.","['nonentity', 'mingle', 'deft', 'imperious', 'imperious', 3]"
pithy,"She was known for her pithy remarks that always cut straight to the point, leaving no room for misunderstanding","His speech was concise and pithy, capturing the audience's attention with its sharp wit and insightful commentary","Despite her quiet demeanor, she had a talent for delivering pithy one-liners that resonated with others",The professor's lectures were filled with pithy anecdotes and clever quips that made the material engaging and memorable,"In a world cluttered with verbose communication, she valued the power of pithy messages that could convey volumes in just a few words.","['inch', 'pithy', 'matriculate', 'crass', 'caustic', 1]"
refine,"To achieve success in any endeavor, it is important to continuously refine your skills and processes",Take the time to refine your goals and objectives to ensure they align with your values and aspirations,"By seeking feedback and actively refining your work, you can improve its quality and relevance",It is through a process of refinement that we can hone our craft and strive for excellence,"Embrace the opportunity to refine, grow, and evolve to reach your full potential.","['unruly', 'mingle', 'figurehead', 'refine', 'severe', 3]"
underscore,The professor used the whiteboard to underscore the key points of her lecture,His actions seemed to underscore the importance of punctuality in the workplace,The dark clouds in the sky seemed to underscore the approaching storm,The athlete's impressive performance only served to underscore her talent and dedication to her sport,The somber music played in the background underscored the emotional intensity of the scene in the movie.,"['underscore', 'stanza', 'panegyric', 'movement', 'underscore', 0]"
spoke,"She calmly spoke to the audience during her speech, capturing everyone's attention with her confident delivery","As she spoke about her personal experiences, her voice conveyed a sense of sincerity and passion","The words she spoke resonated with the listeners, prompting nods of agreement and understanding","Each time she spoke, it was clear that she believed in the message she was sharing, making her words all the more powerful","When she finished speaking, the room erupted in applause, a testament to the impact of her words.","['spoke', 'eleemosynary', 'transcend', 'temporize', 'prosperous', 0]"
prudent,"In order to make a prudent decision, it is important to carefully weigh all the pros and cons of the situation",Being prudent means taking a cautious and thoughtful approach to managing risks and making choices,It is prudent to save money for unexpected expenses or emergencies to avoid financial difficulties in the future,A prudent investor will diversify their portfolio to minimize potential losses,"Overall, it is wise to be prudent in all aspects of life to ensure long-term success and stability.","['footloose', 'prudent', 'prolix', 'spoke', 'filter', 1]"
knit,"She loved to knit colorful scarves during the winter months, finding solace in the repetitive motion of the needles","Her grandmother taught her how to knit when she was young, passing down a tradition that had been in their family for generations","The soft yarn would slip through her fingers as she worked, creating intricate patterns with each stitch","As she knit, she would often lose track of time, fully immersed in the peaceful rhythm of the craft",The scarves she knit were not only warm and cozy but also infused with the love and memories of all the hours spent creating them.,"['interminable', 'temporize', 'summon', 'knit', 'depreciate', 3]"
severe,The severe storm caused widespread damage to homes in the neighborhood,The doctor diagnosed the patient with a severe case of pneumonia and prescribed antibiotics,The severe drought in the region has led to water shortages and crop failures,The severe punishment for the crime served as a deterrent to others considering similar actions,The forecast predicts severe weather conditions with heavy rain and strong winds expected in the area.,"['traverse', 'severe', 'bonhomie', 'transcend', 'legion', 1]"
exodus,"Following the devastating natural disaster, an exodus of residents fled the coastal town in search of safer grounds",The exodus of refugees from the war-torn country put a strain on neighboring nations,The exodus of investors from the stock market resulted in a sharp decline in stock prices,The sudden exodus of employees from the company left many projects unfinished,The mass exodus of wildlife from their habitats due to deforestation is a concerning issue for conservationists.,"['imperturbable', 'exodus', 'prosperous', 'transcend', 'eleemosynary', 1]"
legion,"The ancient Romans were known for their powerful and disciplined legions, which were the cornerstone of their military might",Each legion consisted of thousands of well-trained soldiers who formed a formidable force on the battlefield,The Roman legions were highly organized and effectively commanded by experienced officers,The loyalty and cohesion within a legion were crucial for its success in warfare,"The defeat of a Roman legion was a rare occurrence, testament to their exceptional training and discipline.","['instill', 'exodus', 'filter', 'legion', 'guilt', 3]"
unruly,The unruly students in the classroom were constantly disrupting the lesson with their loud conversations and refusal to follow instructions,Their unruly behavior made it difficult for the teacher to maintain order and focus on teaching the material,"Despite numerous warnings, the unruly group continued to ignore the rules and show little respect for their peers",The teacher knew it was important to address the unruly behavior promptly to prevent it from escalating further,"By implementing a strategy to manage the unruly students, the teacher hoped to create a more positive and productive learning environment for everyone.","['permanence', 'headlong', 'imprecise', 'crass', 'unruly', 4]"
exhilarate,The thrilling roller coaster ride exhilarated Sarah as she felt the rush of adrenaline,The beautiful scenery and fresh mountain air exhilarated the hikers on their challenging trek,The crowd's cheers and excitement exhilarated the football team as they scored the winning goal,"The music at the concert was so lively and energizing, it exhilarated the audience and had them dancing all night",The unexpected plot twist in the movie exhilarated viewers and left them on the edge of their seats.,"['depreciate', 'panegyric', 'prosperous', 'exhilarate', 'amorphous', 3]"
abuse,Abuse is a serious issue that can have lasting effects on individuals,It is important to recognize the signs of emotional abuse in relationships,Physical abuse can leave both physical and emotional scars on a person,"Verbal abuse can be just as damaging as physical abuse, impacting one's self-esteem and mental well-being",Seeking help and support is crucial for anyone experiencing abuse in any form.,"['severe', 'figurehead', 'resonant', 'wither', 'abuse', 4]"
camaraderie,The atmosphere in the team project was filled with camaraderie as everyone worked towards a common goal,The shared laughter and sense of unity among team members created a strong camaraderie that was palpable,"Despite facing challenges, the camaraderie among colleagues never wavered, reflecting a deep bond built on mutual respect and collaboration","During late nights of brainstorming and problem-solving, the camaraderie grew stronger as team members supported each other through every step","The camaraderie within the group extended beyond the project, establishing a foundation for lasting friendships and professional connections.","['imperious', 'prolix', 'overbearing', 'camaraderie', 'guilt', 3]"
instill,It is important for parents to instill values of respect and kindness in their children from a young age,Teachers play a crucial role in instilling a love for learning and curiosity in students,Leaders must strive to instill a sense of trust and accountability within their teams,Reading books can instill a sense of empathy and understanding towards others,"Through consistent practice and guidance, mentors can instill the necessary skills and knowledge in their mentees.","['content', 'pithy', 'instill', 'temporize', 'doyen', 2]"
seminal,The scientist's seminal research in the field of genetics revolutionized our understanding of heredity,Her groundbreaking work has become a seminal reference point for future studies in the discipline,The artist's seminal painting marked the beginning of a new artistic movement,This seminal book on economics continues to be a key text in university courses around the world,The musician's seminal album inspired a generation of artists and reshaped the music industry.,"['headlong', 'instill', 'melody', 'seminal', 'knit', 3]"
invigorate,The fresh mountain air will invigorate your senses and rejuvenate your mind as you embark on a hike through the lush forest,Let the sound of the rushing river invigorate your spirit as you relax by its banks and soak in the peaceful surroundings,A cup of hot herbal tea in the morning can invigorate your body and kickstart your day with a dose of energy,Taking a brisk walk in the crisp morning air can invigorate your body and prepare you for a productive day ahead,Engaging in a stimulating conversation with a friend can invigorate your mind and inspire new ideas to flourish.,"['fidget', 'mingle', 'severe', 'invigorate', 'fiasco', 3]"
headlong,"She made a headlong rush towards the finish line, the wind whipping through her hair as she sprinted with determination","Fearlessly, she plunged headlong into the chaotic crowd, pushing her way through to catch a glimpse of the stage","With a headlong dive, he leaped off the cliff, plummeting towards the crystal-clear water below",The headlong pace of the car race sent adrenaline coursing through their veins as they navigated the sharp turns,"Despite the warning signs, she proceeded headlong into the mysterious, dark cave, eager to uncover its secrets.","['filter', 'eleemosynary', 'instill', 'meander', 'headlong', 4]"
crass,"His crass behavior at the dinner party was unacceptable, as he made rude comments and belittled the other guests","Despite several warnings, he continued to display his crass sense of humor, much to the chagrin of everyone around him",It was clear that his lack of manners and tact were a source of discomfort for many in attendance,"The host was mortified by his crass behavior, as it reflected poorly on her ability to invite suitable guests","Ultimately, the evening was ruined by his crass demeanor, leaving a lasting impression on all those who witnessed it.","['crass', 'stylus', 'nonentity', 'jog', 'cacophony', 0]"
florid,"Her writing style was often criticized for being overly embellished and florid, with extravagant descriptions that felt out of place","Despite the florid language, her novel was well-received by critics for its captivating storytelling and unique characters",The florid decorations in the grand ballroom added an air of opulence to the extravagant event,"The florid patterns on the wallpaper clashed with the minimalist furniture in the room, creating a discordant aesthetic",His florid complexion betrayed his nervousness as he delivered his speech to the crowded auditorium.,"['abdicate', 'florid', 'legion', 'rustle', 'prolix', 1]"
amorphous,The amorphous structure of the material made it difficult to classify,"Under the microscope, the cells appeared amorphous in shape, lacking any clear organization",The artist's painting featured vibrant colors blending together in an amorphous swirl,Scientists were intrigued by the amorphous behavior of the substance when exposed to extreme temperatures,"Despite its amorphous nature, the sculpture conveyed a sense of fluidity and movement.","['guarantee', 'stanza', 'curtail', 'amorphous', 'traverse', 3]"
inch,"Sure, here is a paragraph with the word 'inch' used in five sentences: The caterpillar inched its way along the leaf, moving slowly and deliberately","As the storm approached, the wind picked up, causing the tree branches to inch closer to the window","She measured the fabric carefully, making sure each inch was accounted for before cutting",The marathon runner could feel every inch of the race taking a toll on their exhausted body,"The old clock on the mantel chimed, each inch of its hands marking the passing time.","['inch', 'steadfast', 'cacophony', 'offbeat', 'pilot', 0]"
antidote,An antidote is a substance that can counteract the effects of a poison or toxin in the body,"When administered promptly, an antidote can neutralize the harmful effects and save a person's life","There are various antidotes available for different types of poisonings, ranging from snake bites to drug overdoses",It is crucial to have access to the appropriate antidote in emergency situations to provide effective treatment,Hospitals and healthcare facilities are equipped with antidotes to address poisonings and ensure the best possible outcomes for patients.,"['vitiate', 'lariat', 'offbeat', 'stylus', 'antidote', 4]"
jovial,"The elderly man greeted everyone with a jovial smile, spreading cheer throughout the room","His jovial personality made him a favorite among his colleagues, always ready with a witty joke or a kind word","Even on the rainiest days, he maintained a jovial demeanor that lifted the spirits of those around him",The jovial atmosphere he created made the workplace feel more like a family than just a job,"People were drawn to his jovial nature, finding solace in his positive attitude and infectious laughter.","['temporize', 'offbeat', 'jovial', 'matriculate', 'spoke', 2]"
stylus,A stylus is a small tool that is often used with touchscreens to input commands,Many artists prefer using a stylus for creating digital artwork due to its precision,"The stylus enables users to draw, write, and navigate on their devices with greater accuracy",Some styluses come with additional features such as pressure sensitivity for more advanced functionality,"Whether for note-taking or detailed illustrations, a stylus can enhance the user experience on various electronic devices.","['panegyric', 'bargain', 'fidget', 'stylus', 'prudent', 3]"
filter,"In today's digital age, it is essential to use a filter when browsing the internet to protect your personal information",A popular social media platform allows users to enhance their photos with various filter options,It is important to regularly clean or replace the air filter in your home to maintain good air quality,Some people use a water filter in their homes to ensure that their drinking water is free from contaminants,"When shopping online, you can use a price filter to narrow down products within your budget.","['cacophony', 'effulgence', 'filter', 'stylus', 'eleemosynary', 2]"
nonentity,"In the vast universe, many stars burn brightly, while others remain mere nonentities in the cosmic expanse","Despite his aspirations, he felt like a nonentity amongst the successful entrepreneurs at the conference","The politician's promises turned out to be mere illusions, rendering him a nonentity in the eyes of the public","Caught in the shadow of her more famous sibling, she often felt like a nonentity in her own family","As the days passed, his contributions at work went unnoticed, leaving him feeling like a nonentity in the office hierarchy.","['nonentity', 'rustle', 'exhaust', 'melody', 'augur', 0]"
traverse,"The hikers began their journey early in the morning, eager to traverse the rugged terrain ahead","As they made their way through the dense forest, they found themselves having to traverse fallen trees and winding paths","With each step, they felt a sense of accomplishment as they continued to traverse the challenging landscape","The leader of the group guided them skillfully, choosing the best route to traverse the mountain safely","Finally, after hours of hard work, they reached the summit, proud of their ability to traverse such a demanding trail.","['imprecise', 'temporize', 'offbeat', 'melody', 'traverse', 4]"
censure,The school board voted to censure the teacher for her inappropriate conduct in the classroom,The senator faced public censure for his controversial remarks during the debate,The company's CEO received a formal censure from the board of directors for his unethical behavior,The journalist came under harsh censure from the public for spreading misinformation in her article,"Despite facing censure from some members of the community, the artist stood by her controversial artwork.","['facile', 'effulgence', 'amorphous', 'censure', 'ally', 3]"
effulgence,"The effulgence of the morning sun slowly spread across the dew-covered meadow, casting a warm golden light over the landscape","The effulgence of the full moon shimmered on the tranquil surface of the lake, creating a serene and magical aura","As the day progressed, the effulgence of the summer sky intensified, painting the world in vibrant hues of blue and white","The effulgence of the city lights twinkled in the distance, a mesmerizing sight against the backdrop of the dark night sky","In that moment, surrounded by the effulgence of nature and civilization, a sense of peace and wonder enveloped me.","['eleemosynary', 'mire', 'temporize', 'effulgence', 'delicacy', 3]"
paranoia,"Her paranoia grew stronger with each passing day, causing her to constantly check her surroundings for any signs of danger","The feeling of paranoia made it difficult for her to trust even those closest to her, as she became suspicious of their intentions","The paranoia became so overwhelming that she started to avoid leaving her house, fearing that something bad would happen if she did","Despite her efforts to rationalize her thoughts, the grip of paranoia on her mind only seemed to tighten","She longed for a sense of peace and clarity, free from the constant weight of paranoia bearing down on her.","['interminable', 'footloose', 'mire', 'protocol', 'paranoia', 4]"
lariat,"The cowboy deftly swung his lariat around the steer's neck, capturing it with precise aim",The shimmering silver lariat glinted in the sunlight as it swirled through the air,"With a quick flick of his wrist, the cowboy tightened the lariat, bringing the steer to a gradual halt",The lariat twisted and twirled elegantly as the cowboy expertly roped the unruly cattle,The skillful handling of the lariat showcased the cowboy's mastery of the art of ranching.,"['fiasco', 'lariat', 'spoke', 'transcend', 'wither', 1]"
vitiate,His reckless behavior threatened to vitiate all the hard work and progress that had been made on the project,The negative comments from the client did nothing but vitiate the team's morale and motivation,It is important to address any issues promptly to prevent them from vitiating the overall success of the initiative,The decision to cut corners could vitiate the quality and integrity of the final product,It is crucial to remain vigilant and proactive to prevent anything from vitiating the positive atmosphere within the team.,"['camaraderie', 'rustle', 'meander', 'vitiate', 'eleemosynary', 3]"
threadbare,The old armchair in the corner of the room had a threadbare cushion that desperately needed to be replaced,The once luxurious rug in the hallway was now worn and threadbare from years of foot traffic,"She carefully folded the threadbare sweater, knowing it was time to donate it to a charity",The ancient book in her hands was bound in a threadbare cover that was beginning to fray at the edges,"Despite its threadbare appearance, the blanket still provided a sense of comfort and familiarity.","['inch', 'threadbare', 'trivial', 'caustic', 'melody', 1]"
eccentric,"She always stood out in a crowd with her eccentric fashion sense, never afraid to experiment with bold colors and patterns","Her eccentric taste extended to her home decor, where she displayed an eclectic mix of vintage furniture and modern art pieces","Despite her eccentric quirks, she was incredibly charming and charismatic, attracting many admirers with her unique personality","Some found her eccentric behavior puzzling, but those who knew her well appreciated her creativity and free spirit","In a world full of conformity, her eccentric spirit shone brightly, inspiring others to embrace their individuality.","['vitiate', 'jovial', 'eccentric', 'doyen', 'mingle', 2]"
temporize,"In times of uncertainty, it may be tempting to temporize and delay making a decision","However, it is important to remember that temporizing can lead to missed opportunities and stagnant progress",Some leaders may choose to temporize as a strategy to buy more time or gather more information before acting,It is crucial to strike a balance between taking decisive action and temporizing when necessary,"Ultimately, the ability to recognize when to temporize and when to act decisively is a valuable skill in leadership.","['filter', 'temporize', 'fidget', 'wan', 'eccentric', 1]"
trivial,"The professor dismissed the student's question as trivial, focusing instead on more pressing matters",The trivial issue of what to have for lunch quickly escalated into a heated debate among coworkers,"In the grand scheme of things, the trivial disagreement between the neighbors seemed insignificant",Sarah found herself getting easily annoyed by trivial things like misplaced pens and crooked picture frames,"Despite its trivial nature, the puzzle proved to be quite challenging for those attempting to solve it.","['censure', 'caustic', 'ally', 'meander', 'trivial', 4]"
meander,"As I strolled through the winding paths of the park, I couldn't help but meander aimlessly, allowing my thoughts to drift along with the gentle breeze","The river beside me seemed to also meander lazily, snaking its way through the lush greenery","I watched as a small group of ducks meandered along the water's edge, their movements graceful and carefree","The meandering trails through the woods led me to a hidden clearing, where I sat down to meander through the pages of a book","With each meandering step I took, I felt a sense of peace and contentment wash over me, leaving behind the chaos of the outside world.","['prudent', 'stylus', 'wither', 'underscore', 'meander', 4]"
stanza,"In poetry, a stanza is a grouping of lines that often has a specific number of lines and a particular rhyme scheme","Each stanza in a poem can represent a new idea or image, creating a structure for the overall work",The use of stanzas helps to organize the poem and guide the reader's understanding of the themes being presented,Poets may vary the length and structure of stanzas to create different effects within their work,"Overall, the stanza serves as a building block in the construction of a poetic composition, contributing to its form and meaning.","['stylus', 'mingle', 'stanza', 'underscore', 'depreciate', 2]"
caustic,"Her caustic remarks left a bitter taste in the room, dampening the festive atmosphere","Despite her caustic wit, some found her comments amusing, while others were taken aback by her sharp tongue","The caustic feedback from the critics stung, but she remained defiant in her artistic vision","With each caustic retort, she seemed to distance herself further from those around her","In the end, her caustic demeanor only served to alienate those who sought to connect with her on a deeper level.","['cacophony', 'repeal', 'instill', 'antidote', 'caustic', 4]"
jog,Sure thing! Here is a paragraph with the word 'jog' used five times,"After work, I like to clear my mind with a jog around the park near my house",The rhythmic sound of my footsteps hitting the pavement during the jog is soothing,"As I jog, I pass by other runners and exchange nods of encouragement",The fresh air and scenery during my jog always help me feel rejuvenated and energized,"['protocol', 'eleemosynary', 'effulgence', 'caustic', 'jog', 4]"
fiasco,"The event planning committee was confident that the fundraiser would be a huge success, but it turned into a complete fiasco","The caterer arrived late, the sound system malfunctioned, and the guest of honor canceled last minute",The entire evening was a series of unfortunate events that culminated in a chaotic fiasco,"Despite their efforts to salvage the situation, it was clear that the event had turned into a total fiasco","In the end, the committee vowed to plan more carefully and avoid such a fiasco in the future.","['bargain', 'augur', 'poseur', 'fiasco', 'headlong', 3]"
