word,sentence1,sentence2,sentence3,sentence4,sentence5,option_result
concentric,"The target was a series of concentric circles, each one smaller than the last, creating a mesmerizing pattern on the ground",The architect designed a stunning building with concentric layers that seemed to blend seamlessly into each other,"The geologist pointed out the concentric layers in the rock formations, evidence of ancient geological processes","The artist meticulously painted concentric rings on the canvas, using a steady hand to achieve perfect symmetry","As the meditation session began, participants were instructed to focus on the image of concentric circles to center their thoughts and find inner peace.","['brandish', 'concentric', 'fickle', 'angst', 'insufferable', 1]"
extremity,The doctor examined the patient's extremity and noted signs of swelling and bruising,The extreme pain in the extremity indicated a possible fracture,A tight bandage was applied to the extremity to reduce the swelling,The patient was instructed to avoid putting weight on the injured extremity,It was crucial to monitor the extremity for any changes in color or temperature.,"['insufferable', 'fickle', 'extremity', 'circumnavigate', 'homage', 2]"
circumnavigate,"The intrepid sailor set out to circumnavigate the globe, determined to explore every corner of the vast ocean","His journey was filled with challenges, from treacherous storms to encounters with exotic marine wildlife","Despite the obstacles, he remained resolute in his mission, driven by a deep sense of adventure and a thirst for discovery","Every mile he sailed brought him closer to his goal, and with each passing day, he grew more determined to complete his daring voyage","And so, with unwavering determination and unwavering courage, he continued to circumnavigate the world, knowing that the ultimate reward awaited him at the end of his incredible journey.","['obviate', 'sumptuous', 'platonic', 'circumnavigate', 'deplore', 3]"
quintessential,"The picturesque countryside cottage, with its charming thatched roof and blooming garden, is the quintessential place to escape the hustle and bustle of city life","Surrounded by lush greenery and melodious bird songs, it embodies the quintessential tranquility of rural living",The aroma of freshly baked bread wafting from the kitchen and the crackling of the fireplace in the cozy living room add to the quintessential charm of the cottage,"As the sun sets behind the rolling hills, casting a warm golden glow over the landscape, the beauty of nature in its quintessential form unfolds","Stepping outside to breathe in the crisp evening air, one can't help but feel grateful for this quintessential retreat from the chaos of everyday life.","['paranoia', 'calamity', 'aghast', 'quintessential', 'angst', 3]"
marginal,"In economics, the concept of marginal analysis is crucial for decision-making",Understanding the marginal cost and marginal benefit of a particular choice helps individuals and businesses make optimal decisions,The marginal utility of an additional unit of a good or service is an important consideration in consumer behavior,Marginal revenue and marginal cost are key factors in determining the level of production that maximizes profits for a firm,"Overall, considering the marginal implications of different options can lead to more efficient and effective outcomes.","['interminable', 'atrophy', 'ecosystem', 'marginal', 'correlation', 3]"
integral,The process of cooking a meal is an integral part of preparing a delicious dish,Understanding the integral relationship between supply and demand is crucial for businesses to thrive,Communication skills are integral for building strong relationships in both personal and professional settings,Time management is integral in achieving productivity and meeting deadlines,Education is integral for personal growth and development throughout one's lifetime.,"['continuum', 'referendum', 'syntax,', 'dissemble', 'integral', 4]"
insufferable,Her insufferable attitude made it challenging to work with her on the group project,Every interaction with her was met with insufferable arrogance and condescension,The insufferable heat of the summer sun beat down on us as we tried to find shelter,"Despite his insufferable behavior, she tried to maintain a professional demeanor",The insufferable noise from the construction site next door made it impossible to focus on her work.,"['insufferable', 'homage', 'fickle', 'dissemble', 'brandish', 0]"
cartography,"Cartography, the art and science of map-making, has evolved significantly throughout history",Early cartographers relied on traditional tools and methods to produce maps of the world,"Today, digital technology has revolutionized cartography, allowing for more detailed and accurate representations of our world","The field of cartography encompasses various specialized areas, including Geographic Information Systems (GIS) and thematic mapping","Cartography plays a crucial role in numerous fields such as geography, urban planning, and environmental science.","['cartography', 'fester,', 'defile', 'appellation', 'secede', 0]"
abase,The politician's scandalous behavior led to his reputation being abased in the eyes of the public,He tried to abase his opponent by spreading false rumors and lies about him,It is never appropriate to abase someone in order to make oneself look better,A true leader does not resort to abasing others to achieve success,"Let us strive to lift each other up, rather than abase one another.","['angst', 'abase', 'exodus', 'underpinning', 'foster', 1]"
obviate,"To obviate any potential conflicts of interest, the company implemented strict guidelines for employees working on sensitive projects","By addressing the issue head-on, the management sought to obviate any misunderstandings or doubts among the team members","The new software update was designed to obviate the need for manual data entry, saving employees time and reducing errors",Proactive measures were taken to obviate any security breaches and protect sensitive information stored on the company's servers,The goal of these initiatives was to obviate risks and ensure smooth operations within the organization.,"['avert', 'correlation', 'obviate', 'brouhaha,', 'bliss,', 2]"
fickle,"The weather in this city is notoriously fickle, with sudden changes in temperature and precipitation",People often find it challenging to make plans due to the fickle nature of the climate,"She was known for being fickle in her relationships, constantly changing her mind about who she wanted to be with","The stock market can be seen as fickle, as it can fluctuate greatly based on various factors",It can be frustrating to deal with fickle technology that works inconsistently.,"['fickle', 'avert', 'lascivious', 'abase', 'exodus', 0]"
rivet,The mechanic used a rivet gun to secure the metal pieces together,The loud sound of each rivet being hammered in echoed throughout the workshop,The rivet joints provided a strong and durable connection between the materials,"As the project progressed, more and more rivets were added to reinforce the structure",The precision and skill required to properly install each rivet were evident in the finished product.,"['exodus', 'bemoan,', 'rivet', 'rapture', 'correlation', 2]"
droll,Her droll sense of humor often caught people off guard with its unexpected wit and charm,"Whether she was recounting a mundane event or sharing an amusing anecdote, her droll delivery never failed to elicit laughter",The way she cleverly incorporated droll remarks into conversations made her a delightful presence in social gatherings,"Some might find her droll quips slightly subtle, but those who appreciated dry humor found her absolutely delightful",It was her unique ability to infuse any situation with a touch of droll humor that truly set her apart.,"['intermittent', 'integral', 'droll', 'sumptuous', 'concentric', 2]"
muster,"In an attempt to muster up the courage to speak in front of the large crowd, Sarah took a deep breath and stepped onto the stage",She knew she needed to muster all her strength to face the challenging situation ahead,"Despite feeling nervous, Sarah tried to muster a smile to show her confidence","With every ounce of determination she could muster, Sarah began her speech with a shaky voice","As she continued speaking, Sarah found that she was able to muster more confidence and deliver her message effectively.","['muster', 'dolt', 'syntax,', 'appellation', 'ratify', 0]"
"syntax,",Understanding the syntax of a programming language is crucial for writing efficient and error-free code,A misplaced semicolon or a missing parenthesis can lead to syntax errors that can be difficult to debug,Mastering the syntax allows programmers to communicate instructions to the computer in a structured and logical manner,Different programming languages have their own unique syntax rules and conventions that must be followed for the code to be valid,Continuous practice and familiarity with the syntax of a language can greatly enhance a programmer's productivity and ability to write complex algorithms.,"['avert', 'paranoia', 'syntax,', 'ingratiate', 'protege', 2]"
armament,The country invested heavily in new armament technologies to bolster its military capabilities,The armament race between the superpowers during the Cold War led to increased tensions globally,The government announced a significant budget allocation for the procurement of advanced armament systems,Experts debated the ethical implications of developing autonomous armament that could lead to unmanned warfare,International treaties were signed to regulate the proliferation of armament and prevent the escalation of conflicts.,"['muster', 'insufferable', 'ecosystem', 'rarefied', 'armament', 4]"
predecessor,The new manager faced high expectations as she took over from her successful predecessor,The company's latest product had to live up to the standards set by its popular predecessor,"With a different approach than her predecessor, the new CEO aimed to revolutionize the industry","Despite the challenges left by his predecessor, the new mayor remained determined to make a positive impact",Comparisons between the current president and her predecessor were inevitable in the midst of a heated election season.,"['dissemble', 'predecessor', 'infringe', 'ingratiate', 'fester,', 1]"
delinquent,There have been reports of a delinquent teenager vandalizing public property,The school counselor is working with the delinquent student to address behavioral issues,The community has expressed concerns about the rise in delinquent behavior among young people,The police are increasing patrols in areas known for high delinquent activity,It is important for parents to be involved in their child's life to prevent them from becoming delinquent.,"['concentric', 'rarefied', 'delinquent', 'contraband', 'quintessential', 2]"
platonic,"Their relationship was purely platonic, based on friendship and mutual respect","Despite their close bond, they both understood the importance of keeping things platonic",Platonic love can be just as deep and meaningful as romantic love,"They enjoyed spending time together in a platonic way, sharing interests and experiences",Maintaining boundaries helped them keep their connection purely platonic.,"['platonic', 'paranoia', 'interminable', 'deity,', 'ratify', 0]"
brandish,"As the knight approached, he began to brandish his gleaming sword, ready for battle","The menacing pirate captain stood at the helm of his ship, brandishing a cutlass in his hand","The magician theatrically brandished his wand, casting spells with a flick of his wrist","The protesters brandished their signs high in the air, demanding justice",The celebrity flashed a smile and brandished her latest endorsement deal for the cameras.,"['brandish', 'syntax,', 'lavish', 'abase', 'cartography', 0]"
foray,"She decided to make a foray into the world of baking, excited to try her hand at creating delicious pastries and cakes","With a sense of curiosity and determination, she embarked on this new foray, eager to learn and improve her culinary skills","Her foray into the unknown kitchen territory was met with both challenges and successes, pushing her to experiment with different recipes and techniques","Despite initial setbacks, she persisted in her foray and eventually found her rhythm, delighting friends and family with her sweet creations",The foray into baking not only brought her joy and satisfaction but also unleashed a newfound passion for exploring the art of pastry-making.,"['critique', 'foray', 'rivet', 'defile', 'hypocrisy', 1]"
chaff,"The farmer stood in the field, watching the wind carry away the chaff from the harvested wheat",She knew that separating the chaff from the grain was crucial for a successful harvest,"The chaff danced in the air, creating a swirling pattern against the blue sky","As the chaff floated away, the farmer felt a sense of satisfaction knowing that the precious grains were safely collected","With each gust of wind, more chaff dispersed, leaving behind a field of golden kernels ready for processing.","['accede', 'marginal', 'intermittent', 'triumvirate', 'chaff', 4]"
aversion,"She couldn't quite explain her aversion to public speaking, but the mere thought of standing in front of a large audience made her palms sweat and her heart race","Despite her aversion, she knew she needed to overcome her fear in order to advance in her career","The very idea of confrontation filled her with an overwhelming aversion, causing her to avoid conflict at all costs",Her aversion to spicy food stemmed from a childhood experience of accidentally biting into a hot pepper that left her gasping for air,The therapist helped her recognize that her aversion to vulnerability was hindering her ability to form deep connections with others.,"['brandish', 'aversion', ',dispassionate', 'syntax,', 'ecosystem', 1]"
adduce,"In order to support her argument, the lawyer was prepared to adduce a variety of evidence during the trial","She planned to adduce witness testimonies, expert opinions, and documentary evidence to establish her case beyond a reasonable doubt",The opposing counsel objected to the admissibility of some of the evidence adduced by the defense,"Despite the challenges, the lawyer remained confident in her ability to effectively adduce evidence that would sway the jury in her client's favor","By successfully adducing all relevant evidence, she hoped to secure a favorable verdict for her client.","['adduce', 'ingratiate', 'defile', 'deplore', 'platonic', 0]"
appellation,"An appellation is a term used to designate a particular name, title, or label given to a person or thing","In the world of wine, the appellation on a bottle signifies the region where the grapes were grown",The appellation of a wine can provide valuable information about its origin and quality,"Some wines are classified by their specific grape variety, while others are known for their prestigious appellation",Understanding the significance of an appellation can enhance one's appreciation and enjoyment of wine.,"['protege', 'appellation', 'predecessor', 'lavish', 'defile', 1]"
dissemble,"She attempted to dissemble her true feelings with a smile, masking the worry in her eyes","Throughout the meeting, he carefully dissembled his intentions, leaving his colleagues unsure of his true motives","Despite his efforts to dissemble his nervousness, his shaky hands betrayed his anxiety","In politics, politicians often dissemble their true beliefs to gain favor with various groups","It can be exhausting to constantly dissemble one's emotions, leading to a sense of disconnection from oneself.","['platonic', 'adduce', 'rapture', 'ludicrous', 'dissemble', 4]"
homage,"The film was a beautiful homage to classic Hollywood cinema, with stunning cinematography and elegant costumes that paid tribute to an era gone by","The director skillfully weaved in subtle nods to iconic scenes from legendary movies, creating a sense of nostalgia for longtime fans",The script was filled with clever references that acted as an homage to the work of influential filmmakers who had come before,"The music, too, served as a poignant homage to the great composers of the past, setting the perfect tone for each emotional moment in the story","Overall, the film was a heartfelt homage to the art of filmmaking itself, celebrating the creativity and passion that goes into crafting a truly unforgettable piece of cinema.","['ingratiate', 'exodus', 'dispirit', 'bliss,', 'homage', 4]"
liaison,The new project manager will act as the primary liaison between the sales team and the marketing department to ensure seamless communication and collaboration,Establishing a strong liaison with key stakeholders is crucial for the success of the product launch next month,The external consultant will serve as a liaison to facilitate partnerships with vendors and suppliers for the upcoming event,The HR department plays a vital role as a liaison in resolving workplace conflicts and addressing employee concerns,We need to appoint a liaison officer to maintain open lines of communication with our international partners.,"['cloy', 'liaison', 'contraband', 'lascivious', 'deity,', 1]"
ecosystem,An ecosystem is a complex network of organisms interacting with their physical environment,The balance within an ecosystem is crucial for maintaining biodiversity and sustainability,"Human activities can have a significant impact on an ecosystem, leading to disruptions and destruction",Conservation efforts are essential to protect ecosystems and the delicate web of life within them,It is important for us to understand and appreciate the interconnectedness of all living beings within an ecosystem.,"['ecosystem', 'insufferable', 'platonic', 'ingratiate', 'climatic', 0]"
secede,"The southern states attempted to secede from the Union during the Civil War, leading to a series of contentious battles","Despite their efforts, the secession movement ultimately failed as the Union forces prevailed","The decision to secede sparked widespread debate and turmoil throughout the country, with both sides fiercely defending their beliefs","The lingering effects of the failed secession attempt reverberated for years to come, shaping the course of American history","Today, the notion of seceding from the United States remains a controversial topic, fraught with political, legal, and ethical implications.","['avert', 'secede', 'dispirit', 'adduce', 'calamity', 1]"
accede,"Her decision to accede to their demands was met with relief, as it meant avoiding a prolonged conflict","Despite her initial hesitations, she eventually agreed to accede to the terms of the treaty in order to foster peace",The leader's willingness to accede to the requests of his constituents earned him respect and loyalty,It was clear that the company could not succeed unless they were willing to accede to the changing market conditions,"As negotiations continued, both parties found common ground and were able to accede to a mutually beneficial agreement.","['infringe', 'accede', 'fickle', 'integral', 'extremity', 1]"
lascivious,"His lascivious stare lingered on her, making her uncomfortable in his presence","The way he spoke dripped with suggestive innuendos, his words laced with a lascivious tone that sent shivers down her spine","His lascivious behavior at the party drew disapproving glances from the other guests, who were taken aback by his boldness",It was evident that his intentions were far from innocent as he continued to engage in lascivious gestures towards her,"In that moment, she knew she had to remove herself from his lascivious advances before things escalated further.","['syntax,', 'circumnavigate', 'lascivious', 'referendum', 'calamity', 2]"
ingratiate,"In her attempt to ingratiate herself with the new boss, Jane constantly praised his work and offered to help with any projects he had","Despite her efforts to ingratiate, the boss seemed unimpressed and kept his distance, preferring to maintain a professional relationship",Jane's attempts to ingratiate with her colleagues by bringing in coffee and treats were met with gratitude and smiles,It was clear that she was trying to ingratiate herself with the team in hopes of gaining their favor,"However, some team members saw through her insincere attempts to ingratiate and remained wary of her motives.","['foster', 'cloy', 'syntax,', 'ingratiate', 'secede', 3]"
captivate,The intricate details of the artwork captivate the viewer and hold their gaze,The magician's performance was so captivating that the audience was left in awe,"The melody of the song seemed to captivate everyone in the room, creating a magical atmosphere","The author's storytelling skills are truly captivating, drawing readers into the world of the novel effortlessly",The charismatic speaker had a way of captivate his audience with his compelling arguments and engaging presence.,"['captivate', 'draconian', 'angst', 'intermittent', 'bliss,', 0]"
exodus,"As the threat of war loomed closer, many families decided to embark on a mass exodus from the city",The exodus resulted in overcrowded roads and packed trains as people scrambled to seek safety elsewhere,"Despite the chaos, there was a sense of unity among the exodus of refugees, all striving for a better future","The exodus continued for days, with each passing hour bringing both hope and uncertainty","Ultimately, the exodus marked a turning point in the region's history, leaving behind an empty cityscape filled with memories of those who had fled.","['referendum', 'critique', 'rarefied', 'exodus', 'interminable', 3]"
critique,"During the art exhibition, the renowned critic delivered a detailed critique of the featured paintings, pointing out the artist's use of color and composition","The critique captivated the audience, sparking a lively discussion about the meaning and message behind each artwork",Artists often seek critiques from their peers to improve their craft and gain valuable feedback on their creative process,"Some view critique as a necessary step in the artistic journey, helping them push boundaries and refine their skills",Constructive critique can be a powerful tool for growth and development in the world of art and beyond.,"['deity,', 'rapture', 'apostasy', 'attest', 'critique', 4]"
chaste,"She maintained a chaste demeanor, never giving in to the temptations around her",Her chaste attire reflected her commitment to modesty and purity,"The young couple vowed to remain chaste until marriage, upholding their beliefs and values","Despite the advances of others, she stood firm in her chaste principles, never compromising her integrity","In a world filled with distractions, she remained resolute in her decision to lead a chaste life.","['chaste', 'ludicrous', 'adduce', 'hypocrisy', 'critique', 0]"
wary,"She entered the dark forest cautiously, her senses on high alert, feeling wary of any potential dangers lurking in the shadows","The sound of rustling leaves made her even more wary, causing her to slow her pace and scan her surroundings","Every unfamiliar noise made her heart race, and she remained constantly wary of any movement in the underbrush","Her wary eyes darted back and forth, surveying the eerie landscape for any signs of trouble","Despite her growing unease, she pressed on, determined to reach her destination.","['calamity', 'rarefied', 'wary', 'adduce', 'muster', 2]"
referendum,A referendum is a direct vote in which the entire electorate is asked to either accept or reject a particular proposal,The government proposed a national referendum to gather public opinion on the new tax reform,The referendum results showed a clear majority in favor of the proposed changes,Many countries use referendums to decide important issues such as constitutional amendments or membership in international organizations,The outcome of the referendum will ultimately shape the future of our society.,"['denomination', 'predecessor', 'continuum', 'infringe', 'referendum', 4]"
continuum,"The concept of time is often viewed as a continuum, where the past, present, and future exist simultaneously","In quantum physics, particles can exist in multiple states along a continuum until they are observed",The color spectrum is a continuum of colors blending seamlessly from one to another,"Understanding human behavior requires recognizing that emotions exist on a continuum, from joy to sorrow","In music, the continuum of sound frequencies creates melodies that evoke various emotions in listeners.","['integral', 'hypocrisy', 'platonic', 'insufferable', 'continuum', 4]"
paranoia,"As the deadline approached, Sarah's paranoia heightened, causing her to second-guess all her decisions","The constant whispers of doubt in her mind fueled her paranoia, leading to a perpetual state of anxiety","Every small mistake was magnified in her eyes, fueling her paranoia even further","Sleep became elusive as her mind raced with paranoid thoughts, keeping her on edge throughout the night","Despite reassurances from her friends and family, Sarah's paranoia continued to consume her, casting a shadow over her every move.","['paranoia', 'referendum', 'marginal', 'defile', 'rarefied', 0]"
dolt,Ethan couldn't believe he was being criticized by such a dolt in the meeting,"Despite his best efforts to explain the concept clearly, the dolt just couldn't grasp the idea",It was frustrating to deal with someone so dense and lacking in basic understanding,The dolt's constant interruptions only served to hinder progress on the project,"In the end, Ethan decided it was best to avoid working with such a dolt in the future.","['dolt', 'syntax,', 'chaff', 'defile', 'rarefied', 0]"
