word,sentence1,sentence2,sentence3,sentence4,sentence5,option_result
wither,The once vibrant flowers in the garden slowly began to wither under the scorching summer sun,"The leaves on the trees started to wither and curl as autumn approached, signaling the changing of seasons","The farmer's crops began to wither due to the lack of rainfall, causing concern for the upcoming harvest","The old wooden fence surrounding the property started to wither away, showing signs of decay and neglect","As the days passed without proper care, the neglected house began to wither into a state of disrepair, abandoned and forgotten.","['jog', 'underscore', 'protocol', 'wither', 'traverse', 3]"
poseur,"In social settings, the poseur always sought to impress others with his flashy attire and pretentious demeanor","Despite his attempts to appear sophisticated and cultured, many saw through his facade and recognized him as nothing more than a poseur",His exaggerated gestures and affected accent only served to further highlight his poseur-like behavior,The poseur's constant need for attention and admiration made it difficult for him to form genuine relationships with those around him,"Eventually, his reputation as a poseur caught up with him, leading to a sense of isolation and loneliness.","['overbearing', 'ally', 'jovial', 'mire', 'poseur', 4]"
demur,"Though initially hesitant to demur, she ultimately decided to voice her concerns during the meeting","He chose to demur politely when asked to lead the project, citing his lack of experience in that particular area","Despite her reservations, she couldn't help but demur when offered the opportunity to speak at the conference",The team members were taken aback by his unexpected demurral to participate in the team-building exercise,"As the debate grew heated, she demurred from further engaging in the argument to maintain professionalism.","['demur', 'stanza', 'steadfast', 'abdicate', 'melody', 0]"
foil,The chef used aluminum foil to wrap the leftovers before placing them in the refrigerator,She carefully crimped the edges of the foil to ensure a tight seal,The foil prevented any leaks or spills from contaminating other food items in the fridge,"Once reheating the leftovers, the chef peeled back the foil to reveal the steaming hot meal inside",The foil also helped in keeping the food moist and flavorful.,"['foil', 'invigorate', 'headlong', 'meander', 'antidote', 0]"
resonant,"His resonant voice echoed through the hall, captivating everyone in the audience","The sound of the piano filled the room with a deep, resonant melody that stirred emotions within the listeners",The resonant harmonies of the choir created a powerful and moving performance,"As the sun set, the resonant hum of cicadas in the distance provided a soothing backdrop to the evening",The author's words had a resonant quality that lingered in the minds of readers long after they had finished the book.,"['legion', 'jovial', 'resonant', 'imprecise', 'abdicate', 2]"
summon,"Sure, here is a paragraph with the word 'summon' used in five different sentences: The old wizard waved his wand and muttered a spell to summon a powerful dragon to aid him in battle",The queen used a magical amulet to summon a protective barrier around her kingdom,The villagers gathered at the ancient stone circle to summon the spirits of their ancestors for guidance,The sorcerer's incantation was able to summon a thunderstorm to bring much-needed rain to the drought-stricken land,The sacred ritual involved the participants chanting in unison to summon a benevolent deity for blessings and protection.,"['summon', 'vitiate', 'sedentary', 'ally', 'content', 0]"
delicacy,"In many cultures, sampling various delicacies is considered a significant part of dining etiquette",The delicate flavors of a well-prepared dish can evoke a sense of appreciation and admiration for the culinary arts,Some people have a refined palate that allows them to discern the nuances of different delicacies,Serving a delicacy at a special occasion can elevate the dining experience and create lasting memories for guests,Chefs often take pride in their ability to create exquisite delicacies that showcase their skills and creativity.,"['wan', 'imprecise', 'doyen', 'delicacy', 'offbeat', 3]"
prosperous,"The small town was once a prosperous community, with thriving businesses lining the main street and well-maintained homes dotting the tree-lined neighborhood","Despite facing economic challenges in recent years, the residents remained hopeful for a return to prosperous times, working together to revitalize the local economy",The town's leaders implemented new initiatives and programs to attract investors and support local entrepreneurs in their efforts to bring back prosperity,"Slowly but steadily, the town began to see signs of a prosperous future ahead, with new shops opening up and a renewed sense of optimism spreading among the residents","As the town continued to grow and flourish, it was evident that their collective efforts were leading them towards a bright and prosperous tomorrow.","['repeal', 'abuse', 'prosperous', 'interminable', 'underscore', 2]"
panegyric,"She delivered a heartfelt panegyric at his memorial service, praising his kindness and generosity in touching the lives of many",The panegyric speech was filled with anecdotes and memories that highlighted his positive impact on those around him,The attendees were moved by the eloquent panegyric that captured the essence of his character and spirit,"The heartfelt panegyric brought tears to the eyes of many, showcasing the deep love and respect felt for the departed soul",The panegyric served as a fitting tribute to a life well-lived and a legacy that would endure in the hearts of all who knew him.,"['foil', 'transcend', 'invigorate', 'lariat', 'panegyric', 4]"
carve,"Sure, here is a paragraph with the word 'carve' in five different sentences: The skilled artist used a sharp chisel to meticulously carve intricate designs into the wooden sculpture","As the sun set, the silhouette of the mountains appeared to be carved against the colorful sky",The chef deftly wielded a knife to carve a beautifully presented watermelon into a work of art,Ancient civilizations used to carve symbols and hieroglyphics into stone tablets for communication and record-keeping,"The wind and rain had slowly begun to carve away at the edges of the ancient ruins, erasing history bit by bit.","['carve', 'overbearing', 'transcend', 'augur', 'exodus', 0]"
bargain,I found a great bargain on a designer handbag yesterday at the outlet mall,"The store was having a clearance sale, so I got it for half the original price","The quality of the handbag was exceptional, especially for the bargain I received",I love searching for bargains when I go shopping; it makes the experience even more enjoyable,Finding a good bargain always puts me in a good mood for the rest of the day.,"['prudent', 'temporize', 'bargain', 'imprecise', 'movement', 2]"
lampoon,"In his latest comedy sketch, the talented comedian chose to lampoon the politician's controversial statements with sharp wit and clever satire",The audience erupted into laughter as he expertly used lampoon to highlight the absurdity of the current political climate,"His lampooning of societal norms and conventions was both thought-provoking and entertaining, leaving the audience with much to ponder","With a knack for lampooning cultural stereotypes, the comedian effortlessly navigated sensitive topics with humor and grace, pushing boundaries while keeping the audience engaged","As a master of lampoon, he skillfully used humor to shed light on important issues, making his performance not only entertaining but also impactful.","['legion', 'overbearing', 'deft', 'jovial', 'lampoon', 4]"
transcend,"An artist's vision can often transcend beyond the limitations of reality, creating a world that is both enchanting and captivating","The power of music has the ability to transcend language barriers, touching the hearts and souls of people from different cultures","Through acts of kindness and compassion, we can transcend our own self-interests and make a positive impact on the world around us",The beauty of nature can inspire us to transcend our everyday worries and connect with something greater than ourselves,It is within moments of deep reflection and meditation that we may transcend our mundane existence and tap into a sense of inner peace and enlightenment.,"['vitiate', 'transcend', 'meander', 'fidget', 'pilot', 1]"
mire,"The heavy rain turned the once firm ground into a deep mire, making it difficult to traverse the path",The travelers found themselves sinking deeper into the mire with each step they took,"The horses struggled to navigate through the thick mire, their hooves getting stuck in the mud","The mire seemed endless, stretching out before them as far as they could see","Despite their best efforts, they were unable to escape the grasp of the treacherous mire.","['prudent', 'pilot', 'stanza', 'stylus', 'mire', 4]"
steadfast,"Her steadfast dedication to her goals was truly admirable, never wavering in the face of challenges","She remained steadfast in her beliefs, even when others tried to sway her","Despite the difficulties she faced, her resolve remained steadfast, inspiring those around her","With a steadfast commitment to excellence, she pushed herself to achieve greater heights","Her steadfast loyalty to her friends and family never faltered, earning her respect and trust from all who knew her.","['invigorate', 'steadfast', 'antidote', 'repeal', 'threadbare', 1]"
ecstasy,"As the music pulsated through the crowded club, a feeling of ecstasy washed over the dancers on the dance floor",The combination of flashing lights and thumping beats created an atmosphere of pure ecstasy,"With each sip of their drinks, the partygoers felt their senses heighten in ecstasy",The DJ's skillful mixing of tracks sent the crowd into a state of complete ecstasy,"In that moment, surrounded by strangers but connected through music, they all experienced a collective wave of ecstasy.","['caustic', 'nonentity', 'permanence', 'ecstasy', 'guilt', 3]"
augur,The dark clouds gathering in the sky augur a looming storm on the horizon,Farmers often look to nature's signs to augur the success of their upcoming crops,The sudden drop in stock prices seemed to augur bad news for the financial market,Some people believe that dreams can be used to augur future events,The old fortune teller claimed to possess the ability to augur one's fate by reading the lines in their palm.,"['fervor', 'augur', 'nonentity', 'protocol', 'augur', 1]"
bonhomie,The annual office party was filled with laughter and bonhomie as colleagues mingled and shared stories from the past year,"There was a sense of warmth and camaraderie in the air, creating a festive atmosphere that brought everyone together","The CEO's speech highlighted the importance of teamwork and collaboration, further enhancing the spirit of bonhomie among the staff","As the night went on, the music and dancing added to the overall feeling of joy and bonhomie in the room",It was a memorable evening that strengthened the bonds of friendship and goodwill among coworkers.,"['demur', 'bonhomie', 'invigorate', 'deft', 'unruly', 1]"
ally,"In times of need, having a reliable ally can make all the difference","It is important to choose your allies wisely, as they can greatly impact your success","Trust and loyalty are essential qualities in an ally, fostering a strong bond between individuals","Allies join together to achieve common goals, supporting each other through challenges and triumphs","With the support of a trusted ally, one can feel empowered to face whatever obstacles may come their way.","['guarantee', 'ally', 'transcend', 'vitiate', 'steadfast', 1]"
rustle,"As I walked through the dense forest, I could hear the subtle rustle of leaves under my feet",The gentle rustle of the wind through the branches added to the peaceful atmosphere,"Suddenly, a loud rustle in the bushes made me stop in my tracks, my heart racing with anticipation","The rustle of the leaves revealed a small chipmunk scurrying away, causing a smile to spread across my face",The symphony of rustles and chirps in the forest made me feel completely immersed in nature's beauty.,"['interminable', 'temporize', 'rustle', 'renovate', 'eccentric', 2]"
fidget,"She couldn't help but fidget nervously as she waited for the important meeting to start, twisting her pen between her fingers",The constant fidgeting of the toddler during the long car ride was starting to test her patience,"As she sat through the lecture, she noticed the student next to her continuously fidgeting with his phone, unable to stay still",He had a habit of fidgeting with the buttons on his shirt whenever he felt anxious or unsure,"The quiet room was filled with the sound of pencils tapping and feet shuffling, a symphony of fidgeting that made it hard to concentrate.","['ally', 'augur', 'personable', 'protocol', 'fidget', 4]"
cacophony,"The cacophony of honking cars, blaring sirens, and yelling pedestrians filled the busy city street","Amidst the cacophony, she struggled to hear her own thoughts and tried to focus on the task at hand",The cacophony of the construction site next door made it difficult to concentrate on her work,The cacophony of excited children playing in the park brought a sense of joy to the neighborhood,"Despite the cacophony of voices around her, she felt a sense of peacefulness while sitting by the river, listening to the water flow.","['cacophony', 'rustle', 'doyen', 'severe', 'pithy', 0]"
figurehead,"The CEO served as a mere figurehead in the company, with little actual decision-making power","Despite being the face of the organization, the figurehead had limited influence on strategic direction",Many employees saw the figurehead as a symbolic leader rather than a hands-on manager,The board of directors appointed the figurehead based on their public image and reputation rather than their leadership skills,"Over time, it became clear that the figurehead was just a puppet for the real power brokers behind the scenes.","['rustle', 'personable', 'inch', 'figurehead', 'instill', 3]"
content,"He felt a sense of inner contentment as he sat by the fireplace, surrounded by loved ones and a warm cup of tea","The content of the presentation captivated the audience, leaving them eager to learn more","The website's content was informative and engaging, keeping visitors coming back for more","Despite facing challenges, she remained content with her progress and determined to keep moving forward","Finding peace in the simplicity of nature, she couldn't help but feel content with the world around her.","['lariat', 'amorphous', 'depreciate', 'bonhomie', 'content', 4]"
deft,"His deft fingers moved swiftly across the piano keys, creating a melodic tune that filled the room with warmth",The chef's deft handling of the knife impressed everyone in the kitchen as he effortlessly diced the vegetables,"With a deft twist of her wrist, she expertly untangled the knot in the fishing line",The magician's deft sleight of hand left the audience in awe as he made a coin disappear and reappear,"The painter's deft brushstrokes brought the portrait to life, capturing every detail with precision.","['rustle', 'traverse', 'severe', 'deft', 'ally', 3]"
personable,"She is known for her warm and personable nature, always greeting everyone with a smile",Her personable demeanor makes it easy for her to connect with people of all backgrounds,"Despite her busy schedule, she always finds time to engage in personable conversations with her colleagues",The key to her success lies in her ability to be both professional and personable in her interactions,"People are drawn to her friendly and personable approach, making her a valuable asset in any team setting.","['instill', 'personable', 'protocol', 'facile', 'temporize', 1]"
renovate,"The old house was in desperate need of renovating, as its outdated design and worn-out fixtures were showing signs of disrepair","The homeowners decided to renovate the entire property, starting with the kitchen and bathrooms to bring a modern touch to the space","They hired a team of skilled contractors to help with the renovation process, including tearing down walls and installing new flooring throughout","The renovation project took several months to complete, but the end result was a beautifully renovated home that exceeded their expectations","Overall, the decision to renovate the house brought new life to the property and increased its market value significantly.","['baroque', 'cacophony', 'abandon', 'lampoon', 'renovate', 4]"
offbeat,"The offbeat rhythm of the music filled the room, creating a unique atmosphere","She was drawn to offbeat fashion choices, always standing out from the crowd","His offbeat sense of humor often caught people off guard, but it never failed to make them laugh",The film's offbeat storyline kept the audience engaged and guessing until the very end,They decided to take an offbeat hiking trail to explore the hidden gems of the forest.,"['offbeat', 'footloose', 'deft', 'imperturbable', 'exhilarate', 0]"
prolix,"His prolix speeches often left the audience feeling overwhelmed by the sheer amount of information he attempted to convey, leading to boredom and disinterest","Despite his prolix writing style, he struggled to effectively communicate his ideas in a concise and engaging manner",The prolix nature of his presentations made it difficult for listeners to discern the main points amidst the sea of unnecessary details,"Colleagues often avoided engaging in conversations with him due to his prolix tendencies, preferring instead to interact with more succinct communicators","His prolixity became a hindrance in professional settings, overshadowing his knowledge and expertise with its excessive verbosity.","['invigorate', 'depreciate', 'pilot', 'prolix', 'fidget', 3]"
abdicate,"King Henry decided to abdicate the throne, citing health reasons and a desire to spend more time with his family",The announcement of his abdication shocked the nation and sparked a debate on the succession process,Many wondered who would be the next in line to assume the responsibilities of the monarchy,The royal council convened to discuss the implications of the king's decision to abdicate and to plan for a smooth transition of power,"Despite the uncertainty surrounding the abdication, the people remained hopeful for a stable and prosperous future under new leadership.","['fidget', 'abdicate', 'prolix', 'exodus', 'depreciate', 1]"
interminable,"The journey through the dense forest seemed interminable, with no end in sight","The hikers trudged along the winding path, feeling exhausted by the seemingly interminable trek","The oppressive heat made the walk feel even longer, adding to their sense of interminable discomfort",Each step forward felt like a struggle against the interminable obstacles of nature,"As the sun began to set, casting long shadows across the trail, the group was filled with a sense of interminable dread at the thought of spending the night in the wilderness.","['overbearing', 'jovial', 'interminable', 'prudent', 'abandon', 2]"
repeal,The government's decision to repeal the controversial law met with mixed reactions from the public,Many citizens applauded the move as a step towards progress and justice,"However, some critics argued that the repeal was rushed and lacked sufficient consultation","Despite the lingering debates, the repeal officially came into effect last month",The repeal marked a significant shift in government policy and sparked discussions about future legislative changes.,"['paranoia', 'pilot', 'repeal', 'instill', 'steadfast', 2]"
guarantee,"I can assure you that our products come with a satisfaction guarantee, ensuring that you are fully happy with your purchase",We guarantee that our services will meet your expectations and provide the results you desire,Rest assured that we stand behind our work with a money-back guarantee if you are not completely satisfied,Our company's longstanding reputation for quality and reliability is a guarantee of our commitment to excellence,Trust in our guarantee of superior customer service and support whenever you need assistance.,"['guarantee', 'mire', 'prolix', 'pilot', 'headlong', 0]"
overbearing,His overbearing attitude made it difficult for his colleagues to approach him with new ideas,The overbearing heat of the sun beat down relentlessly on the hikers as they trekked through the desert,She felt suffocated by her mother's overbearing control over every aspect of her life,The manager's overbearing presence in meetings often overshadowed the contributions of other team members,"Despite his overbearing personality, he was well-respected for his strong leadership skills.","['jog', 'depreciate', 'overbearing', 'fiasco', 'bonhomie', 2]"
movement,"As she entered the crowded room, she felt the familiar buzz of movement all around her",The rhythmic movement of the dancers on the dance floor was mesmerizing,The gentle movement of the leaves in the breeze outside the window added a sense of calm to the chaotic scene,The quick movement of her hand as she reached for her phone made the decision to call him,The fluid movement of the yoga instructor guided the class through a series of poses with grace and ease.,"['carve', 'exodus', 'augur', 'offbeat', 'movement', 4]"
mingle,"While attending the conference, attendees had the opportunity to mingle with industry experts and share their ideas",The networking event provided a great space for professionals to mingle and establish new connections,Guests were encouraged to mingle with each other during the cocktail hour,The art gallery opening was the perfect place for artists and art enthusiasts to mingle and discuss the latest trends,The community picnic was a fun way for neighbors to mingle and bond over good food and conversation.,"['exhilarate', 'inch', 'mingle', 'bargain', 'facile', 2]"
facile,Her facile charm and quick wit made her a favorite among her colleagues,"Despite her facile explanation, the teacher knew she hadn't put much effort into her assignment",The politician's facile promises were met with skepticism by the public,It was a facile task for him to navigate through the complex coding language,She possessed a facile ability to adapt to new situations effortlessly.,"['movement', 'facile', 'camaraderie', 'permanence', 'poseur', 1]"
exhaust,She arrived at work feeling completely exhausted after a sleepless night,The long hours of overtime had left her physically and mentally drained,"Despite her exhaustion, she knew she had to push through the day ahead",The constant demands of her job seemed to only add to her sense of exhaustion,"As the day wore on, she longed for the moment she could finally rest and recharge.","['depreciate', 'censure', 'exhaust', 'filter', 'imperious', 2]"
curtail,"To curtail unnecessary spending, the company implemented strict budget controls across all departments",The government decided to curtail access to public parks in order to prevent the spread of the virus,"In an effort to curtail pollution, the city introduced new regulations on emissions from factories",The school board voted to curtail the use of electronic devices in classrooms to improve student focus,"To curtail the rising crime rates, law enforcement increased patrols in high-crime areas.","['caustic', 'movement', 'fidget', 'curtail', 'renovate', 3]"
fervor,"The crowd cheered with fervor as the team scored a last-minute goal, securing their victory",There was a fervor in the air as people gathered to protest against injustice and demand change,"The speaker delivered her passionate speech with fervor, inspiring the audience to take action",The fervor of the debate intensified as both sides presented their arguments with unwavering conviction,"The artist painted with fervor, pouring his emotions onto the canvas with each brushstroke.","['camaraderie', 'headlong', 'antidote', 'prudent', 'fervor', 4]"
footloose,It's time to feel footloose and fancy-free as we dance the night away under the starry sky,"With no inhibitions holding us back, we let our feet move to the rhythm of the music with pure joy",The feeling of being footloose fills our hearts with happiness and a sense of freedom,"As we twirl and swirl on the dance floor, we leave behind all worries and simply embrace the moment",Let's cherish this footloose feeling and savor the memories we create on this magical night.,"['repeal', 'unruly', 'summon', 'wan', 'footloose', 4]"
depreciate,"Over time, most cars tend to depreciate in value due to wear and tear",It is common for electronic devices to depreciate quickly as newer models are released,Real estate prices can fluctuate and may appreciate or depreciate based on market conditions,Businesses often depreciate their assets over time to account for wear and obsolescence,It is important to consider how an investment may depreciate before making a financial decision.,"['footloose', 'severe', 'depreciate', 'sedentary', 'trivial', 2]"
