word,sentence1,sentence2,sentence3,sentence4,sentence5,option_result
propitious,"The propitious weather conditions on the day of the picnic made it a truly enjoyable event, with clear blue skies and a gentle breeze","As luck would have it, we found a propitious spot underneath a large oak tree that provided ample shade throughout the day","The propitious timing of our arrival meant that we avoided the heavy traffic on the way to the park, allowing us to set up our picnic without any delays","With such a propitious start to the day, it was no surprise that everything seemed to fall perfectly into place, creating a sense of harmony and joy among all the participants","Reflecting on the propitious turn of events, we couldn't help but feel grateful for the wonderful day we had experienced together.","['propitious', 'vex', 'admonish', 'salient', 'abhor,', 0]"
grandiose,"The grandiose mansion stood proudly at the top of the hill, commanding attention with its towering columns and intricate detailing","Its grandiose ballroom was adorned with sparkling chandeliers and luxurious drapes, creating an ambiance of opulence and sophistication","The grandiose garden sprawled out in front of the estate, showcasing vibrant flowers and pristine pathways","Every corner of the grandiose property exuded an air of elegance and extravagance, reflecting the wealth and status of its owners","Visitors were often in awe of the grandiose beauty that enveloped the entire estate, leaving a lasting impression on all who beheld its magnificence.","['congenial', 'grandiose', 'noxious', 'hedonism', 'caricature', 1]"
uniform,The students wore their crisp navy blue uniforms proudly as they lined up for morning assembly,"The military personnel stood in perfect formation, all dressed in their formal uniforms",The store clerk measured the customer for a custom-tailored uniform for their upcoming job at the airline company,The debate over whether school uniforms should be mandatory sparked heated discussions among parents and educators,The marching band members practiced tirelessly to ensure they were all in perfect uniformity during the big parade.,"['stymie', 'vitiate', 'assiduous', 'rogue', 'uniform', 4]"
assiduous,"She was known for her assiduous attention to detail, always ensuring that every task was completed with precision and care","Her assiduous work ethic set her apart from her colleagues, as she consistently put in extra hours to meet deadlines and exceed expectations","Despite facing obstacles, she remained assiduous in her pursuit of excellence, never wavering in her dedication to her craft","Her assiduous efforts were recognized and rewarded, earning her a reputation as a reliable and diligent worker","With her assiduous approach to her work, she was able to achieve remarkable success and earn the respect of those around her.","['assiduous', 'consummate', 'demagogue,', 'platitude', 'bourgeois', 0]"
vex,"She found herself increasingly vexed by the persistent noise of construction outside her window, disrupting her peaceful morning routine","Despite her best efforts to remain calm, the constant hammering and drilling continued to vex her nerves","The situation only worsened as the noise grew louder, intensifying her frustration with each passing minute","Feeling trapped in her own home by the unrelenting racket, she struggled to find solace amidst the chaos","Eventually, she decided to escape the vexatious clamor by retreating to a nearby café for some much-needed peace and quiet.","['convivial,', 'flout', 'lampoon,', 'caricature', 'vex', 4]"
"sublime,","The sublime beauty of the sunset painted the sky in hues of pink and orange, casting a peaceful glow over the horizon","Standing on top of the mountain, surrounded by clouds, I felt a sense of sublime awe at the vastness of the landscape below","The musician's performance was nothing short of sublime, moving the audience to tears with his soulful melodies","As I gazed at the magnificent waterfall cascading down the rocks, I was struck by its sublime power and grace","In that moment of complete stillness and solitude, I found a deep sense of peace in the sublime tranquility of nature.","['gregarious', 'salient', 'catharsis', 'sublime,', 'sublime,', 3]"
narcissism,Narcissism is a personality trait characterized by an excessive interest in oneself and one's physical appearance,People with high levels of narcissism often have an inflated sense of their own importance and a deep need for admiration from others,"Narcissism can manifest in behaviors such as self-centeredness, a lack of empathy, and a tendency to manipulate others for personal gain","Those who struggle with narcissism may also experience difficulty forming genuine, meaningful connections with others due to their focus on themselves",It's important to understand the complexities of narcissism and seek support if it is impacting one's relationships and well-being.,"['tentative', 'abridge', 'narcissism', 'noxious', 'latent', 2]"
congenial,The congenial atmosphere at the office made everyone feel comfortable and welcome each day,"Colleagues enjoyed working together in such a congenial environment, which fostered collaboration and creativity",The team's congenial interactions helped them achieve their goals efficiently and effectively,The manager's congenial demeanor and approachable nature contributed to a positive work culture,"Overall, the congenial relationships among coworkers created a supportive and enjoyable work environment.","['inaugurate', 'demagogue,', 'congenial', 'grandiose', 'catharsis', 2]"
machination,"The intricate machination of the antagonist's plan unfolded slowly, revealing layers of deceit and manipulation","Each move was carefully calculated, a web of machination designed to trap the unsuspecting heroes",The villain's machination was so elaborate that it seemed almost impossible to unravel,"Despite the complexity of the machination, the heroes were determined to thwart it at all costs","In the end, the mastermind behind the machination was brought to justice, and peace was restored to the realm.","['milieu', 'morose', 'servile', 'machination', 'rogue', 3]"
emigrate,Many people emigrate to other countries in search of better opportunities and quality of life,Some individuals choose to emigrate due to political unrest or persecution in their home country,Emigrating can be a difficult decision as it often involves leaving behind family and friends,Learning a new language and adapting to a different culture are common challenges faced by those who emigrate,"Despite the challenges, emigrating can also lead to personal growth and new experiences.","['auspicious,', 'fauna', 'emigrate', 'frenetic,', 'mercenary', 2]"
peripatetic,"She led a peripatetic lifestyle, constantly traveling from city to city in search of new experiences",Her peripatetic nature made it difficult for her to put down roots and establish long-lasting relationships,"Despite the challenges of a peripatetic existence, she thrived on the excitement of exploring different cultures","The peripatetic artist drew inspiration from her travels, incorporating elements from each destination into her work",Her peripatetic adventures enriched her life in ways she never could have imagined.,"['peripatetic', 'exacting', 'stymie', 'confluence', 'facetious', 0]"
glut,"Amidst the pandemic, there was a glut of new regulations that impacted businesses across various industries","The market experienced a glut of products due to oversupply, leading to fierce competition among manufacturers",Consumers were delighted to find a glut of discounts and promotions during the holiday season,"However, the glut of information available online made it challenging for individuals to discern between facts and misinformation","Despite the glut of challenges faced in 2020, many organizations found innovative ways to adapt and thrive in the midst of uncertainty.","['glut', 'convivial,', 'comprise,', 'degenerate', 'abhor,', 0]"
itinerant,"An itinerant musician travels from city to city, performing in different venues each night",The itinerant preacher spread his message of love and compassion across the countryside,"An itinerant worker moves from one job to another, never staying in one place for long",The itinerant artist captures the beauty of different landscapes in their paintings,"Despite the challenges of an itinerant lifestyle, many people find freedom and inspiration in constantly being on the move.","['vex', 'ingenuous', 'avuncular,', 'itinerant', 'salient', 3]"
antithesis,"The concept of love can be considered the antithesis of hate, showcasing a stark contrast in emotions","In literature, the character of the villain often serves as the antithesis to the hero, adding depth to the storyline",The antithesis of success is not failure but rather staying stagnant without making any progress,"Philosophically, the antithesis of truth is not necessarily falsehood but could be seen as ignorance","In debates, presenting a strong antithesis to one's own argument can help strengthen the overall perspective and foster critical thinking.","['convivial,', 'antithesis', 'conciliatory', 'onerous', 'prepossess', 1]"
transient,"The beauty of life lies in its transient nature, constantly shifting and evolving",Every moment is a fleeting glimpse into the vast spectrum of emotions and experiences,"We are all mere passengers on this transient journey, never truly anchored to one place or time",Embracing the transient nature of life allows us to appreciate the present moment with gratitude and mindfulness,"Let us cherish the transient connections we make, knowing that they may be fleeting but hold immense value in our hearts.","['servile', 'transient', 'itinerant', 'avuncular,', 'morose', 1]"
integral,Understanding the integral role that communication plays in building strong relationships is crucial in both personal and professional settings,Effective communication is integral to successful collaboration among team members in achieving common goals,It is integral for leaders to possess strong communication skills to inspire and motivate their followers,Developing emotional intelligence is an integral aspect of improving interpersonal communication,"In a fast-paced world, adaptability is integral for individuals to thrive and succeed in various environments.","['integral', 'salient', 'stymie', 'tentative', 'prepossess', 0]"
flout,"Despite the clear rules in place, some individuals choose to flout them openly, displaying a blatant disregard for authority",The wealthy businessman felt he was above the law and continued to flout regulations without consequence,The rebellious teenager enjoyed flouting the school's dress code by wearing ripped jeans and hoodies,The politician's decision to flout ethical standards raised concerns among the public,It is important to address and deter those who consistently flout societal norms and expectations.,"['propensity', 'vitriolic', 'flout', 'pivotal,', 'consummate', 2]"
inaugurate,The president will inaugurate the new hospital wing next month,The ceremony to inaugurate the art exhibit will be held on Friday night,The mayor is scheduled to inaugurate the new public library this weekend,The governor is planning to inaugurate the new technology center in the upcoming week,The CEO will inaugurate the company's new headquarters next year.,"['ideology', 'grandiose', 'pivotal,', 'noxious', 'inaugurate', 4]"
"bastion,","During the medieval era, the castle stood tall as a bastion of power, overlooking the surrounding lands","The fortress served as a formidable bastion against any invading forces, with its high walls and strategic positioning",The king relied on the bastion to protect the kingdom from outside threats and maintain control of the region,The ancient walls of the bastion held many secrets and stories of battles fought to defend the land,"Through centuries of history, the bastion remained a symbol of strength and resilience in the face of adversity.","['machination', 'ingenuous', 'vitriolic', 'exacting', 'bastion,', 4]"
confluence,The confluence of various factors led to the successful outcome of the project,"At the confluence of two rivers, a beautiful park was established for visitors to enjoy",The confluence of technology and art is evident in the stunning virtual reality installations,"In history, the confluence of different cultures often gave rise to unique traditions and practices",The confluence of opinions from experts helped to shape the final decision on the matter.,"['exacting', 'confluence', 'intrinsic', 'vilify', 'vex', 1]"
scrutinise,"In order to make an informed decision, it is crucial to scrutinise all available information thoroughly",Investors often scrutinise a company's financial reports before deciding to invest in its stock,Researchers meticulously scrutinise their data to ensure the accuracy of their findings,Journalists are trained to scrutinise sources and verify information before publishing a story,It is wise to scrutinise details and double-check facts to avoid errors and misunderstandings.,"['confluence', 'scrutinise', 'caricature', 'noxious', 'intrinsic', 1]"
facetious,"My friend's facetious comments always lighten the mood during tense discussions, but sometimes his sarcasm can be misunderstood","Despite his facetious nature, he is known for his sincere and caring personality, always willing to lend a helping hand","His wit and humor are evident in his facetious remarks, making people around him smile and laugh","While some may view his facetious behavior as inappropriate, others appreciate his ability to bring levity to serious situations","Overall, his facetious remarks are a reflection of his playful and mischievous personality.","['agenda', 'facetious', 'litigate', 'noxious', 'portent', 1]"
ingenuous,"His ingenuous smile disarmed even the most cynical of critics, showcasing his genuine enthusiasm for the project","With an ingenuous approach to problem-solving, she often found innovative solutions that others had overlooked","Despite his ingenuous demeanor, he possessed a keen intelligence that caught many by surprise",Her ingenuous charm and sincerity made her a beloved figure in the community,The ingenuous way he approached challenges reflected his optimistic outlook on life.,"['confluence', 'rogue', 'ingenuous', 'convivial,', 'insular,', 2]"
squalor,"He found himself surrounded by the harsh reality of squalor, with dilapidated buildings and litter-strewn streets on every corner","The stench of decay lingered in the air, a constant reminder of the poverty and neglect that plagued the area","Children played barefoot in the dirt, their laughter a stark contrast to the squalor that enveloped them","The community seemed resigned to their fate, trapped in a cycle of squalor that seemed impossible to break","Despite the overwhelming squalor, a sense of resilience and hope still flickered in the eyes of some residents, a small beacon of light in the darkness.","['glut', 'squalor', 'vex', 'avuncular,', 'propensity', 1]"
vitiate,The negative comments of others should not vitiate your self-esteem,It is important not to let fear vitiate your dreams and aspirations,Gossip and hearsay can vitiate relationships and trust between people,Letting bitterness and resentment vitiate your heart will only harm yourself,Guarding against toxic influences can help vitiate the impact they have on your well-being.,"['agenda', 'vilify', 'convivial,', 'cognitive', 'vitiate', 4]"
"avuncular,","In his role as a mentor, the professor displayed an avuncular attitude towards his students, always offering guidance and support","His demeanor was warm and reassuring, creating a sense of trust among those under his tutelage","He effortlessly blended authority with a friendly, avuncular approach, making it easy for students to seek his advice","Many students sought his avuncular wisdom on both academic and personal matters, knowing that he would offer thoughtful and caring advice","His avuncular nature extended beyond the classroom, as former students often sought his counsel long after graduation.","['ardent', 'litigate', 'avuncular,', 'hedonism', 'noxious', 2]"
mercenary,"The mercenary was known for his ruthless tactics on the battlefield, willing to fight for the highest bidder without allegiance to any cause",Rumors circulated about the mercenary's past exploits in various conflicts across the continent,"Despite his reputation as a hired gun, some respected the mercenary for his skills in combat and strategy","The mercenary's loyalty was always up for sale, making him a controversial figure among his peers","In the end, the mercenary knew that his life was defined by the price of his sword and the blood he spilled.","['confluence', 'tacit', 'burlesque', 'mercenary', 'admonish', 3]"
servile,"In the presence of their demanding boss, the employees displayed servile behavior, constantly seeking approval and praise","Their servile attitudes were evident in the way they eagerly complied with every request, no matter how unreasonable","Despite feeling resentful of their servile roles, the employees feared repercussions if they dared to speak up","The workplace had a culture that encouraged a servile mentality, with those who questioned authority quickly reprimanded","Over time, the employees grew tired of the servile facade they had to maintain and began seeking opportunities elsewhere.","['squalor', 'burlesque', 'servile', 'uniform', 'inaugurate', 2]"
litigate,Sure! Litigate is a term used to describe the process of taking a legal dispute to court for resolution,"When parties are unable to reach a settlement, they may choose to litigate their case in front of a judge","Litigate involves presenting evidence, arguments, and legal reasoning to support each party's position",The outcome of a litigated case is ultimately decided by the court based on the presented facts and applicable laws,Many complex legal disputes end up being litigated in order to obtain a final judgment.,"['caricature', 'platitude', 'uniform', 'litigate', 'litigate', 3]"
milieu,"The bustling city streets are filled with diverse individuals from various cultural backgrounds, creating a vibrant milieu of languages and traditions","In this cosmopolitan milieu, one can find a blend of modern architecture alongside historic buildings, symbolizing the dynamic evolution of the urban landscape",The local marketplace adds to the eclectic milieu with its array of exotic fruits and spices that fill the air with enticing aromas,"As night falls, the city transforms into a nocturnal milieu, with neon lights illuminating the streets and creating a dazzling spectacle","Within this ever-changing milieu, one can truly appreciate the beauty of diversity and the richness of human experiences.","['auspicious,', 'milieu', 'cacophony', 'platitude', 'caricature', 1]"
"convivial,",The convivial atmosphere at the family gathering was evident as laughter and animated conversations filled the room,"Guests mingled comfortably, exchanging stories and enjoying the delicious spread of food and drinks","The host's warm hospitality set a convivial tone, ensuring everyone felt welcome and at ease throughout the evening","Music played softly in the background, adding to the convivial ambiance and uplifting spirits","As the night progressed, the convivial spirit of the event lingered, creating lasting memories for all who attended and shared in the joyous occasion.","['confluence', 'stymie', 'convivial,', 'proselytise,', 'rogue', 2]"
portent,The dark clouds gathering on the horizon served as a portent of the impending storm,"As the ancient prophecy foretold, the appearance of a comet was seen as a portent of great change","The sudden appearance of a black cat crossing his path filled him with a sense of unease, believing it to be a portent of bad luck",The eerie silence that descended upon the forest was a portent of danger lurking nearby,The old wise woman's cryptic words were regarded as a portent of wisdom and guidance for the village.,"['prepossess', 'portent', 'auspicious,', 'ideology', 'catharsis', 1]"
tacit,His tacit approval was evident in the way he nodded silently during the meeting,She relied on his tacit understanding of her emotions to provide comfort without words,"The team operated smoothly, each member following the tacit agreement to share responsibilities equally","Despite not discussing it outright, there was a tacit agreement among friends to always support each other in times of need",The unspoken rules governing their friendship were a product of tacit mutual respect and trust.,"['convivial,', 'portent', 'consummate', 'tacit', 'platitude', 3]"
"distend,",The vet observed the dog's distended belly and suspected it might be a sign of a serious health issue,"As the hot air balloon ascended, its colorful envelope began to distend, creating a magnificent sight against the clear blue sky","The pressure buildup in the pipes caused them to distend, eventually leading to a burst","The pregnant woman could feel her abdomen distend with each passing week, a physical reminder of the life growing inside her","The weightlifter's muscles started to distend as he lifted the heavy barbell, showcasing his strength and dedication to the sport.","['distend,', 'chronic', 'vitiate', 'litigate', 'cognitive', 0]"
vilify,It is unfair to vilify someone based on rumors and assumptions,The media often tends to vilify public figures without considering the facts,Vilifying others only spreads negativity and creates tensions in society,We should strive to understand and empathize with others instead of immediately vilifying them,"It is important to remember that everyone deserves to be treated with respect and fairness, regardless of any misunderstandings.","['vilify', 'cacophony', 'fauna', 'uniform', 'morose', 0]"
chronic,"Living with a chronic condition can be challenging, requiring ongoing medical care and management","Chronic pain can significantly impact an individual's quality of life, often leading to physical and emotional distress",People with chronic illnesses may face hurdles in their daily activities due to persistent symptoms,Seeking support from healthcare professionals and loved ones is important when dealing with chronic health issues,It is crucial to prioritize self-care and adopt healthy lifestyle habits to better manage chronic conditions effectively.,"['abridge', 'chronic', 'plethora', 'bourgeois', 'relentless', 1]"
propensity,"She had always shown a propensity for taking risks, often seen diving headfirst into new adventures without hesitation","Despite her propensity for procrastination, she managed to excel in her academic pursuits, earning top marks in all her courses","His propensity for laughter and jokes endeared him to everyone he met, making him the life of the party","The company's CEO had a propensity for making bold decisions that sometimes paid off in huge profits, showcasing his fearless leadership style","Growing up in a chaotic household, she developed a propensity for seeking out stability and calmness in all aspects of her life.","['gregarious', 'prepossess', 'defame,', 'fauna', 'propensity', 4]"
noxious,"The noxious fumes emanating from the factory's chimney choked the surrounding neighborhood, causing residents to suffer from respiratory problems",The noxious odor of the chemicals being used in the laboratory made it difficult for researchers to concentrate on their work,The noxious weeds that had invaded the garden were quickly removed to prevent them from spreading further,"The noxious chemicals spilled into the river, poisoning the water and killing off the aquatic life","The noxious gases released by the volcano created a health hazard for the nearby communities, forcing them to evacuate.","['milieu', 'noxious', 'vitiate', 'catharsis', 'squalor', 1]"
"abhor,","I abhor the idea of cruelty towards animals, believing in treating all living beings with kindness and respect","The thought of violence and discrimination based on race abhor me, as I firmly stand for equality and inclusivity","I abhor the silence surrounding important social issues, advocating for open dialogue and constructive conversations for positive change","It is clear that I abhor laziness and lack of ambition, always striving for personal growth and self-improvement","The notion of environmental destruction and disregard for our planet's well-being abhor me, motivating me to take action towards sustainability and conservation efforts.","['facetious', 'peripatetic', 'defame,', 'abhor,', 'abhor,', 3]"
ideology,Ideology plays a significant role in shaping the beliefs and values of individuals in a society,It serves as a framework for understanding the world and influences people's perspectives on various issues,Different political ideologies can lead to opposing viewpoints on matters such as government policies and social issues,"In some cases, ideologies can create divisions among groups and contribute to conflicts",It is important to critically analyze the ideologies that we subscribe to and consider their implications on society as a whole.,"['propitious', 'confluence', 'ideology', 'platitude', 'bastion,', 2]"
abridge,An abridged version of the novel was published for younger readers,The director decided to abridge the play for a shorter run time,"Despite being an abridged edition, the book still captured the essence of the original story",The teacher asked the students to write an abridged summary of the lengthy article,We watched an abridged version of the classic Shakespearean play at the theater.,"['vex', 'vilify', 'antithesis', 'abridge', 'latent', 3]"
