word,sentence1,sentence2,sentence3,sentence4,sentence5,option_result
constituency,The politician worked hard to gain the trust and support of her constituency through community outreach and town hall meetings,It was important for her to understand the needs and concerns of her constituency in order to effectively represent them in government decisions,"With each policy proposal, she considered how it would impact her constituency and made sure to communicate with them to gather feedback","Despite facing criticism from some members of her constituency, she remained committed to serving them to the best of her ability","Ultimately, her dedication to her constituency led to a strong and lasting connection with the community she served.","['appellation', 'ingratiate', 'liaison', 'integral', 'constituency', 4]"
avert,"In order to avert a potential disaster, the team implemented strict safety protocols",Their quick thinking helped avert a crisis at the last minute,It was important to avert any misunderstandings by clearly communicating expectations,The company took proactive measures to avert any potential roadblocks in the project,"By working together, they were able to avert a major setback and keep the project on track.","['avert', 'extremity', 'armament', 'draconian', 'cloy', 0]"
defile,It is a shame to see such a beautiful landscape defiled by litter and pollution,"The vandals defile the walls of the historic building with graffiti, disrespecting its cultural significance",We must take action to prevent anyone from attempting to defile our sanctuary with harmful intentions,"The company's reputation was defiled by the scandal, tarnishing their image in the eyes of the public","Let us work together to protect and preserve our natural surroundings, ensuring they remain unspoiled and untouched by defilement.","['defile', 'captivate', 'lavish', 'armament', 'brandish', 0]"
facade,The historic building's elaborate facade featured intricate carvings and ornate details that drew admiration from passersby,"Behind the grand facade, however, hid a different reality of neglect and decay that went unnoticed by many",The polished facade she presented to the world masked the inner turmoil and insecurities she kept hidden from others,"The company's sleek facade of success was shattered when financial irregularities were brought to light, exposing a darker truth beneath the surface","Despite the flawless facade of perfection she maintained, cracks began to show as the pressure of keeping up appearances took its toll.","['chaff', 'dispirit', 'facade', 'lavish', 'chaste', 2]"
intermittent,The intermittent rain showers made it difficult to plan outdoor activities during the weekend,"Despite the intermittent interruptions, the team was able to complete the project ahead of schedule",The sound of intermittent fireworks in the distance signaled the start of the annual celebration,His intermittent attendance at the weekly meetings raised concerns among his colleagues,The intermittent power outages caused inconvenience for the residents in the neighborhood.,"['appellation', 'dolt', 'insufferable', 'intermittent', 'avert', 3]"
aghast,"Upon hearing the news of the sudden change in plans, she stood there aghast, unable to comprehend the gravity of the situation","Her friends looked at her with aghast expressions, shocked by the unexpected turn of events","The aghast silence that followed was eerie, amplifying the tension in the room","Aghast at the sight of the wreckage, she realized the magnitude of the disaster that had unfolded before her eyes","As the details of the scandal emerged, the public was left aghast at the depths of deception that had been uncovered.","[',dispassionate', 'integral', 'liaison', 'aghast', 'dispirit', 3]"
rarefied,"The exclusive club was known for its rarefied atmosphere, reserved only for the elite members of society","The musical performance transcended ordinary expectations, creating a rarefied experience for all attendees","Within the rarefied world of haute couture fashion, only a select few designers are able to achieve true innovation","Academia can sometimes feel like a rarefied environment, with its own set of rules and hierarchies","The artist's unique perspective brought a sense of rarefied beauty to their creations, captivating audiences worldwide.","['paranoia', 'abase', 'rarefied', 'quintessential', 'calamity', 2]"
foster,The local animal shelter works tirelessly to foster abandoned pets and provide them with a safe and caring environment,Volunteers play a crucial role in the process by fostering animals in need until they find their forever homes,It is heartwarming to see the community come together to foster a sense of compassion and empathy towards animals,Fostering a positive relationship with pets can have a significant impact on their well-being and overall happiness,Let's continue to foster a culture of kindness and responsibility towards our furry friends.,"['paranoia', 'foster', 'climatic', 'defile', 'muster', 1]"
sumptuous,"The sumptuous banquet hall was adorned with elaborate chandeliers and luxurious draperies, creating an opulent ambiance","Guests marveled at the sumptuous display of colorful floral arrangements on every table, adding a touch of elegance to the event","The chef had prepared a sumptuous feast that delighted the senses, with an array of delectable dishes that tantalized the taste buds","The sumptuous velvet chairs provided comfortable seating for the attendees, who basked in the lavish surroundings","As the evening progressed, the hostess announced a surprise dessert that was nothing short of sumptuous, leaving everyone in awe of the culinary mastery on display.","['brandish', 'abase', 'ratify', 'dissemble', 'sumptuous', 4]"
protege,"The mentor took on a new protege, eager to pass on their knowledge and skills",The protege was determined to learn and grow under the guidance of their mentor,"With dedication and hard work, the protege impressed their mentor with their progress","As time passed, the mentor noticed the protege's confidence and abilities flourishing","Ultimately, the mentor felt a sense of pride in seeing their protege succeed and thrive in their chosen field.","['foray', 'critique', 'protege', 'protege', 'deplore', 2]"
rapture,"The music filled the air with a sense of rapture, lifting the spirits of everyone in the room","The magical sunset painted the sky in hues of pink and orange, inspiring a feeling of pure rapture in those who witnessed it","A smile spread across her face, reflecting the rapture she felt in her heart at that moment","The overwhelming sense of joy and rapture that filled the room was palpable, creating an atmosphere of pure bliss","As they danced under the stars, they were consumed by a feeling of rapture that transcended time and space.","['captivate', 'rapture', 'defile', 'ludicrous', ',dispassionate', 1]"
cloy,"The overly sweet dessert began to cloy my palate, leaving me with a sense of regret for indulging so much","I tried to push through the cloying taste, hoping it would lessen with each bite, but it only intensified",The cloy of the sugary coating on the candies made me crave something savory to balance it out,The cloying scent of the floral perfume lingered in the air long after she had left the room,I found it difficult to enjoy the romantic comedy movie as the predictable plot began to cloy my interest.,"['intermittent', 'cloy', 'bemoan,', 'avert', 'angst', 1]"
"quotidian,","In the quotidian routine of her life, Sarah found solace in the simple tasks of gardening and cooking",The mundane activities of making breakfast and checking emails became an essential part of his quotidian existence,"Despite the repetitive nature of his job, John appreciated the stability and predictability of his quotidian duties",The beauty of quotidian moments such as watching the sunrise or enjoying a cup of tea were not lost on Emily,"Even amidst the chaos of city life, Maria sought to create tranquil and quotidian moments by practicing mindfulness.","['paranoia', 'homage', 'muster', 'circumnavigate', 'quotidian,', 4]"
"brouhaha,","The sudden brouhaha erupted in the crowded marketplace, drawing the attention of everyone nearby","The local news outlets quickly picked up on the sensational brouhaha, spreading the story far and wide","Despite the escalating brouhaha, the authorities were able to maintain order and prevent any further chaos","Eventually, the brouhaha died down as more information came to light, revealing the true nature of the incident","In the aftermath of the brouhaha, the community came together to discuss ways to prevent similar situations in the future.","['secede', 'brouhaha,', 'dispirit', 'critique', 'bemoan,', 1]"
calamity,"The sudden calamity shook the small town to its core, leaving its residents in a state of shock and disbelief","The aftermath of the calamity was chaotic, with emergency services scrambling to provide assistance to those affected","The magnitude of the calamity was overwhelming, causing widespread destruction and loss","In times of calamity, communities often come together to support one another and rebuild what was lost","Despite the devastation caused by the calamity, there was a sense of resilience and hope among the survivors.","['draconian', 'dispirit', 'liaison', 'extremity', 'calamity', 4]"
ludicrous,The suggestion that pigs can fly is utterly ludicrous and goes against all scientific understanding,It is ludicrous to think that a man could survive free-falling from a plane without a parachute,The idea that the Earth is flat is completely ludicrous in the face of centuries of evidence proving otherwise,Some conspiracy theories circulating on the internet are so ludicrous that they defy any logic or reason,Making decisions based on ludicrous assumptions will only lead to disappointment and failure in the long run.,"['bemoan,', 'ludicrous', 'underpinning', 'appellation', 'draconian', 1]"
climatic,The climatic conditions in the region have been steadily changing over the past decade,Researchers predict that these climatic shifts will have a significant impact on agriculture and biodiversity,The local community is taking steps to adapt to the new climatic reality by implementing sustainable practices,Experts are studying historical data to better understand the long-term climatic patterns in the area,It is crucial for policymakers to address the challenges posed by climatic variability in order to ensure the well-being of future generations.,"['dissemble', 'climatic', 'climatic', 'lavish', 'intrigue', 1]"
draconian,The government's draconian measures to control the spread of the virus have faced criticism from civil liberties groups,Many believe that the draconian penalties imposed on offenders are excessive and unjust,The strict and draconian rules imposed in the workplace have led to low employee morale and productivity,"Some argue that a more balanced approach is needed, rather than relying solely on draconian tactics",The draconian nature of the law has sparked debate among lawmakers and the public alike.,"['foster', 'draconian', 'appellation', 'critique', ',dispassionate', 1]"
"fester,","The unresolved issue continued to fester within the team, causing resentment and tension to build up over time","Ignoring the problem only allowed it to fester further, leading to a toxic work environment","Feelings of mistrust and animosity began to fester among the group, making collaboration difficult","Without addressing the underlying issues, the negative emotions would only continue to fester and impact productivity","It was evident that the longer the problem was left to fester, the more damaging its effects would be on the team dynamic.","['fester,', 'chaste', 'dissemble', 'interminable', 'integral', 0]"
underpinning,The underpinning of any successful project lies in thorough planning and preparation,Strong communication among team members serves as the underpinning of a cohesive and efficient working environment,Clear goals and objectives are crucial underpinnings to drive progress and productivity,Building a solid foundation of trust and respect is the underpinning of any healthy relationship,Continuous learning and adaptation are essential underpinnings for staying relevant in today's rapidly changing world.,"['predecessor', 'apostasy', 'constituency', 'circumnavigate', 'underpinning', 4]"
apostasy,"Apostasy is the act of renouncing a religious belief or faith, often considered a serious offense within many traditional religious communities","In some countries, apostasy is punishable by law and can result in severe consequences for those who choose to leave their faith",The fear of apostasy can sometimes lead individuals to stay within a religion even if they no longer believe in its teachings,"Apostasy can be a deeply personal decision, often fraught with emotional, social, and cultural implications","Despite the risks involved, some individuals may feel compelled to embrace apostasy as a means of living authentically according to their own beliefs and values.","['foray', 'chaste', 'apostasy', 'apostasy', 'droll', 2]"
denomination,"There are multiple religious denominations within the community, each with its own beliefs and practices","The currency in the country is available in various denominations, making it convenient for everyday transactions","When filling out official forms, it is important to specify your religious denomination for documentation purposes",The stamps are available in different denominations to cater to various mailing needs,The school hosts an interfaith dialogue to promote understanding and respect among students of different religious denominations.,"['denomination', 'atrophy', 'intermittent', 'protege', 'delinquent', 0]"
attest,I can attest to the fact that the witness will attest to his testimony in court tomorrow,It is important to have multiple people who can attest to the accuracy of the information provided,The signatures on the document will attest to its authenticity,"As a reliable source, I can attest to the validity of the research findings",The notary public can attest to the signing of the legal documents.,"['attest', 'underpinning', 'fester,', 'ingratiate', 'hypocrisy', 0]"
intrigue,The mysterious disappearance of the antique necklace only added to the intrigue surrounding the historic mansion,The cryptic message left behind by the intruder only deepened the sense of mystery and intrigue,"As the detective delved deeper into the case, he uncovered a web of lies and deceit that only served to heighten the intrigue","The townspeople whispered tales of hidden secrets and dark motives, adding an air of intrigue to the small community","With each new clue discovered, the intrigue surrounding the case grew, drawing in more curious onlookers.","['interminable', 'syntax,', 'continuum', 'intrigue', 'bauble', 3]"
deplore,I deplore the lack of respect shown towards others in our society,It is disheartening to see how people deplore the current state of our environment yet do little to make a positive change,We deplore any form of discrimination or injustice that exists in our community,It's important to deplore acts of violence and seek peaceful resolutions to conflicts,Let us come together to deplore hatred and strive for unity and understanding among all people.,"['deplore', 'defile', 'bauble', 'wary', 'delinquent', 0]"
triumvirate,"In ancient Rome, a triumvirate was a political alliance formed by three individuals in order to share power and govern together","The First Triumvirate, consisting of Julius Caesar, Pompey, and Crassus, was a significant example of this type of arrangement",The members of the triumvirate often had different strengths and supported each other's interests to maintain stability in their rule,"However, such alliances were often fraught with power struggles and betrayals as each member sought to increase their own influence",The concept of a triumvirate continues to be studied and analyzed in the context of leadership and governance throughout history.,"['triumvirate', 'lascivious', 'intrigue', 'fickle', 'dolt', 0]"
angst,"Amidst the chaos of everyday life, a sense of angst seemed to linger in the air, casting a shadow over even the brightest moments","The weight of the world's problems added to the general feeling of unease and discontent, leaving many individuals grappling with their own existential angst","It was as though the collective angst of society had reached a tipping point, threatening to engulf everything in its path","Despite efforts to find solace and peace, the underlying angst persisted, a constant reminder of the uncertainties that lay ahead","In the face of such overwhelming angst, finding moments of clarity and purpose became increasingly challenging, requiring a deep inner resolve to navigate through the complexities of modern existence.","['angst', 'cloy', 'obviate', 'rapture', 'draconian', 0]"
"bliss,","Surrounded by the serenity of nature, she closed her eyes and felt a deep sense of bliss washing over her",The warm sun on her skin and the gentle rustling of leaves in the breeze added to her feeling of blissful contentment,"In that moment, all worries and stresses melted away, leaving only a pure sense of bliss in her heart","It was as if time had frozen, allowing her to fully embrace the blissful tranquility of the present moment","With a peaceful smile on her face, she savored the feeling of bliss that enveloped her soul.","['brandish', 'rapture', 'marginal', 'bliss,', 'obviate', 3]"
interminable,"The speaker's speech seemed to drone on with an interminable stream of anecdotes and digressions, testing the patience of the audience","As the meeting stretched into its third hour, the attendees began to feel the weight of the interminable agenda items that still needed to be addressed","The novel's plot was filled with twists and turns, creating an interminable sense of suspense and mystery for the readers","Despite the interminable wait at the airport, the travelers remained hopeful that their delayed flight would soon depart",The monotonous sound of the clock ticking in the empty room added to the interminable feeling of loneliness that engulfed him.,"['marginal', 'bauble', 'interminable', 'atrophy', 'obviate', 2]"
"bemoan,","Many people bemoan the lack of affordable housing options in urban areas, citing it as a significant challenge","They often bemoan the state of healthcare systems, expressing concerns about accessibility and quality of care","Some individuals bemoan the current state of environmental policies, feeling that not enough is being done to address pressing issues",Students frequently bemoan the workload and stress associated with exams and assignments during the school year,"Despite the criticisms, it is common for individuals to bemoan societal inequalities and advocate for change to create a more equitable world.","['protege', 'liaison', 'cloy', 'homage', 'bemoan,', 4]"
dispirit,"The constant setbacks in his career began to dispirit him, making him question his abilities and goals","Despite receiving positive feedback from his peers, he couldn't shake off the feeling of dispiritment that lingered within him",Each rejection letter he received served to further dispirit his hopes of ever achieving his dreams,"The weight of disappointment started to dispirit his once resilient spirit, leaving him feeling lost and doubtful","However, deep down, he knew he had to find the inner strength to overcome the dispiriting challenges he faced and continue pursuing his passions.","['aghast', 'syntax,', 'climatic', 'fester,', 'dispirit', 4]"
contraband,"Many smuggling rings are involved in the illegal trade of contraband goods such as drugs, weapons, and counterfeit products",Customs officers work tirelessly to intercept any contraband entering the country through ports and borders,The smuggling of contraband across international borders poses a serious threat to national security and public safety,The black market thrives on the sale and distribution of contraband items at exorbitant prices,Law enforcement agencies are constantly updating their strategies to combat the trafficking of contraband and apprehend those involved in these illegal activities.,"['rapture', 'chaff', 'contraband', 'secede', 'foray', 2]"
bauble,"The Christmas tree was adorned with an array of colorful baubles, sparkling in the soft light of the room","Each delicate bauble hung gracefully from the branches, reflecting the joy and magic of the holiday season","The children eagerly reached out to touch the shiny baubles, their eyes full of wonder and excitement","As the baubles gently swayed with the breeze, the room seemed to come alive with festive charm","It was a sight to behold, a shimmering display of baubles creating a merry atmosphere for all to enjoy.","['secede', 'bauble', 'interminable', 'chaff', 'brandish', 1]"
ratify,The company's board members unanimously voted to ratify the new partnership agreement during their monthly meeting,"Once ratified, the terms of the contract will be legally binding and enforceable",It is crucial for all parties involved to ratify the agreement in order to proceed with the planned merger,The CEO expressed confidence that the shareholders would ratify the decision without any opposition,"The process of ratifying the agreement may take some time, but it is necessary to ensure that all parties are in agreement before moving forward.","['ratify', 'armament', 'deity,', 'liaison', 'platonic', 0]"
lavish,"The extravagant ballroom was decorated with lavish silk draperies and golden chandeliers, creating a luxurious ambiance",Guests were treated to a lavish feast featuring gourmet dishes and fine wines from around the world,"The host spared no expense in providing lavish entertainment, including a live band and professional dancers","Attendees were impressed by the lavish attention to detail in every aspect of the event, from the intricate floral arrangements to the personalized party favors",It was truly a lavish affair that left a lasting impression on everyone in attendance.,"['angst', 'rivet', 'syntax,', 'underpinning', 'lavish', 4]"
atrophy,"Over time, lack of physical activity can lead to muscle atrophy, causing weakness and decreased mobility","Neurological conditions such as ALS can also result in muscle atrophy, impacting a person's ability to control their movements","Prolonged immobility, like being bedridden, can accelerate the process of muscle atrophy in individuals",It is important to incorporate regular exercise and physical therapy to prevent muscle atrophy and maintain overall strength,Understanding the causes and effects of atrophy can help in developing effective strategies for rehabilitation and improving quality of life.,"['intrigue', 'accede', 'angst', 'rivet', 'atrophy', 4]"
",dispassionate","Her dispassionate analysis of the situation impressed her colleagues, as she was able to remain calm and objective despite the chaos around her","She approached the problem with a dispassionate demeanor, focusing solely on the facts and evidence at hand","Even in the midst of conflict, she maintained a dispassionate attitude, refusing to let her emotions cloud her judgment","Her dispassionate leadership style often led to effective decision-making, as she was able to see beyond personal biases","People sought her dispassionate viewpoint in times of crisis, knowing they could rely on her rationality and clarity of thought.","['sumptuous', 'intermittent', ',dispassionate', 'captivate', 'continuum', 2]"
thwart,"Despite numerous attempts to thwart his plans, the cunning villain always found a way to outsmart his enemies",The team worked tirelessly to come up with a strategy that would thwart any further attacks on their homeland,"Through careful planning and quick thinking, they managed to thwart the assassination attempt on the president",The intricate security measures were put in place to thwart any potential threats to the high-profile event,"Despite their best efforts to thwart the spread of misinformation, the false rumors continued to circulate.","['rapture', 'lascivious', 'constituency', 'dolt', 'thwart', 4]"
correlation,The researcher found a strong positive correlation between exercise and improved mental health,"However, further investigation revealed a negative correlation between sleep duration and productivity","In the study, no significant correlation was observed between coffee consumption and anxiety levels","Interestingly, there was a correlation between social media usage and feelings of loneliness among participants","Overall, the data suggested intricate correlations among various lifestyle factors and emotional well-being.","['rarefied', 'correlation', 'quotidian,', 'dissemble', 'accede', 1]"
"deity,","In various mythologies, a deity is typically seen as a divine being with supernatural powers and abilities",Worshipping a deity is a common practice in many religions around the world,The concept of a deity often plays a central role in shaping beliefs and religious practices,"Different cultures have their own unique interpretations of deities, each with their own distinct characteristics and attributes",Some people believe that a deity is the ultimate source of creation and governs the universe with wisdom and guidance.,"['hypocrisy', 'concentric', 'armament', 'rapture', 'deity,', 4]"
