word,sentence1,sentence2,sentence3,sentence4,sentence5,option_result
pilot,"The experienced pilot smoothly guided the aircraft through turbulent weather conditions, showcasing his skill and expertise","As a commercial pilot, she had logged thousands of hours in the cockpit, always prioritizing the safety of her passengers","The young pilot felt a rush of adrenaline as he successfully completed his first solo flight, marking a significant milestone in his aviation career","With unwavering focus and precision, the pilot navigated the plane to its destination, earning the trust and admiration of the passengers onboard","During the flight, the pilot communicated effectively with the air traffic control tower, ensuring a seamless and efficient journey.","['filter', 'seminal', 'facile', 'pilot', 'fiasco', 3]"
protocol,"In order to ensure smooth communication between devices, it is essential to follow a specific protocol",The network protocol dictates how data is transmitted and received over a network,Adhering to the established protocol helps prevent data loss and ensures data integrity,"When devices communicate, they must adhere to the same protocol to avoid errors",Understanding and implementing the correct protocol is crucial for effective and secure data transfer.,"['renovate', 'knit', 'protocol', 'prosperous', 'movement', 2]"
baroque,The baroque style originated in 17th century Europe and is characterized by ornate decorations and elaborate details,Baroque music is known for its dramatic flourishes and intricate harmonies,"Baroque art often features exaggerated motion and grandeur, reflecting the artistic tastes of the time period","Many famous composers, such as Johann Sebastian Bach and Antonio Vivaldi, were prominent figures in the baroque music era","Baroque architecture can be seen in prominent buildings like the Palace of Versailles in France, showcasing the opulence and intricacy of the style.","['guilt', 'augur', 'baroque', 'mingle', 'effulgence', 2]"
abandon,She felt a deep sense of abandonment when her closest friend decided to abandon her in her time of need,"The feeling of being left alone and abandoned was overwhelming, and she struggled to make sense of it all","Despite the pain of abandonment, she knew she needed to push through and find strength within herself","As she navigated her emotions, she realized that she couldn't let the fear of abandonment hold her back from seeking new connections","With a newfound resilience, she vowed to never abandon herself, no matter the challenges that came her way.","['meander', 'lampoon', 'abandon', 'matriculate', 'caustic', 2]"
sedentary,"Living a sedentary lifestyle can have negative impacts on one's health, such as an increased risk of obesity and cardiovascular diseases","It is important to balance sedentary activities, like sitting at a desk for work, with physical exercise to maintain overall well-being",Studies have shown that prolonged periods of sedentary behavior can lead to muscle stiffness and decreased flexibility,Incorporating regular movement breaks throughout the day can help counteract the effects of being sedentary,"To combat the sedentary nature of modern living, it is recommended to engage in activities that promote physical activity, such as walking or biking.","['wither', 'foil', 'imperious', 'sedentary', 'spoke', 3]"
guilt,"Guilt is a heavy burden to carry, weighing down on the soul with its persistent grip",It can cloud judgment and lead to feelings of regret and self-blame,"The sense of guilt can linger long after a mistake has been made, affecting relationships and mental well-being",People often struggle with how to reconcile their actions and find solace in times of guilt,"Understanding the root of one's guilt can lead to forgiveness and healing, allowing for personal growth and redemption.","['prolix', 'guilt', 'carve', 'ally', 'abdicate', 1]"
wan,"She had a wan smile on her face as she looked out at the sunset, feeling a sense of peace wash over her","The wan light of the moon illuminated the dark night, casting shadows across the empty street","Despite her best efforts, her energy felt wan and depleted after a long day at work",The wan expression in his eyes hinted at a deep sadness that he tried to conceal from the world,"As the wan winter sun began to set, she wrapped herself in a cozy blanket and settled in for the evening.","['temporize', 'interminable', 'wan', 'threadbare', 'instill', 2]"
melody,"The soothing melody carried through the air, intertwining with the gentle rustling of leaves","As the melody danced around her, she closed her eyes and let the music take her away","Each note in the melody felt like a caress on her soul, bringing about a sense of peace and tranquility","Lost in the melody, she felt a connection to something larger than herself, a universal language that spoke to her heart","The melody lingered, leaving behind a trail of warmth and memories that she held close to her heart.","['prudent', 'melody', 'exhaust', 'sedentary', 'traverse', 1]"
imperturbable,His imperturbable demeanor during the crisis impressed everyone in the room,The imperturbable teacher remained calm as chaos erupted in the classroom,She admired his imperturbable attitude in the face of adversity,The CEO's imperturbable nature inspired confidence among the employees,"Despite the unexpected setbacks, he maintained an imperturbable composure that was truly admirable.","['unruly', 'imperturbable', 'baroque', 'resonant', 'overbearing', 1]"
bifurcate,"The river bifurcates into two separate streams, each flowing in its own direction",The decision to pursue two distinct paths will ultimately bifurcate our team's efforts,"A narrow trail in the forest suddenly bifurcates, leaving hikers unsure of which way to proceed","The project manager proposed a plan to bifurcate the budget, allocating resources to two different departments","The company's strategy is to bifurcate its marketing campaigns, targeting different demographics with specific messaging.","['jovial', 'bifurcate', 'fidget', 'unruly', 'headlong', 1]"
matriculate,"Upon successful completion of their high school education, students looking to pursue higher studies often matriculate at universities across the country","The process of matriculating involves submitting applications, transcripts, and other required documents for admission consideration","Once admitted, students must matriculate by enrolling in classes and paying tuition fees for the semester",It is an exciting time for many young individuals as they matriculate into a new chapter of their academic journey,Matriculating students often attend orientation programs to familiarize themselves with campus resources and academic expectations.,"['protocol', 'matriculate', 'legion', 'lampoon', 'effulgence', 1]"
imprecise,"Her painting technique was imprecise, causing the lines to appear blurred and undefined","The instructions for the assignment were imprecise, leaving students confused about what was expected","The clock in the classroom ran imprecise, often leading to discrepancies in the timing of classes","The weather forecast was imprecise, with frequent changes in predicted conditions throughout the day","Despite her best intentions, her memory of the events was imprecise, leading to inaccuracies in her retelling of the story.","['severe', 'imperturbable', 'exodus', 'imprecise', 'overbearing', 3]"
permanence,The concept of permanence brings a sense of stability and assurance in an ever-changing world,"As humans, we often seek permanence in our relationships, jobs, and surroundings to feel grounded and secure","However, it's important to understand that nothing in life is truly permanent, and embracing impermanence can lead to personal growth and resilience",Striving for permanence in all aspects of life may lead to disappointment and missed opportunities for adaptation and transformation,Finding a balance between seeking permanence and accepting change is essential for a fulfilling and meaningful life journey.,"['interminable', 'doyen', 'eccentric', 'permanence', 'foil', 3]"
eleemosynary,Eleemosynary organizations provide invaluable support to communities in need through their philanthropic efforts,The foundation's eleemosynary activities help fund crucial programs for underprivileged individuals,Many universities rely on eleemosynary contributions to provide scholarships for deserving students,Donations to eleemosynary causes can make a significant impact on society at large,The church's eleemosynary work includes feeding the homeless and providing shelter for those in need.,"['guarantee', 'sedentary', 'legion', 'underscore', 'eleemosynary', 4]"
