word,sentence1,sentence2,sentence3,sentence4,sentence5,option_result
egalitarian,"An egalitarian society values equality and fairness, ensuring that all individuals have access to the same opportunities and resources",The concept of egalitarianism promotes the idea that no one should be discriminated against or disadvantaged based on their background or circumstances,"In an egalitarian system, wealth and power are distributed evenly among all members of society, reducing the gap between the rich and the poor",Egalitarian principles contribute to creating a more just and inclusive community where everyone is treated with respect and dignity,Embracing egalitarian values can lead to a more harmonious and cooperative society where everyone has a chance to thrive.,"['egalitarian', 'dissolution', 'eminent', 'epitome', 'edify,', 0]"
fidelity,"Fidelity is a quality highly valued in personal relationships, symbolizing loyalty and trust","Without fidelity, it is difficult to build lasting and meaningful connections with others",Many people prioritize fidelity in their partnerships as a fundamental cornerstone of a successful and fulfilling relationship,"Fidelity extends beyond romantic relationships and can be seen in friendships, family bonds, and professional collaborations","Cultivating fidelity requires open communication, mutual respect, and a commitment to honoring one's promises and commitments.","['fidelity', 'cogent', 'imminent', 'profess,', 'utopia,', 0]"
acute,She felt an acute sense of panic as she realized she had lost her way in the dense forest,The acute pain in his chest made him cringe with each breath he took,"The doctor diagnosed her with an acute case of pneumonia, requiring immediate treatment","With acute precision, she cut through the thick rope binding her hands",The sudden sound of thunder caused an acute sense of fear to wash over the campers.,"['abate', 'acute', 'revere', 'utopia,', 'conventional', 1]"
antecedent,"An antecedent is a word, phrase, or clause that comes before a pronoun and gives it context","In English grammar, the antecedent is typically the noun or pronoun that the pronoun refers to",It is crucial to have a clear antecedent in a sentence to avoid confusion for the reader,Understanding the antecedent in a sentence helps to establish the proper relationship between different parts of a sentence,"Without a clear antecedent, it can be challenging for the reader to understand the intended meaning.","['antecedent', 'appropriate,', 'malinger', 'epitome', 'broach', 0]"
paradigm,The shift in technology has brought about a new paradigm in the way we approach business,This new paradigm emphasizes innovation and adaptability over traditional methods,Companies that fail to embrace this paradigm risk falling behind in a rapidly evolving market,"As the paradigm continues to change, organizations must be willing to challenge existing norms and embrace new ways of thinking",Embracing this paradigm shift is essential for staying competitive in today's business landscape.,"['bereaved', 'evanescent', 'martyr', 'incisive', 'paradigm', 4]"
imminent,"The storm clouds gathered overhead, signaling the imminent arrival of a heavy rain shower",The detective's intuition warned him of the imminent danger lurking in the shadows,"As the deadline approached, the team worked tirelessly to meet the imminent project completion date",The scientist's research hinted at the imminent breakthrough in cancer treatment,The captain's voice conveyed a sense of urgency as he warned the crew of the imminent pirate threat on the horizon.,"['succumb', 'irrevocable', 'broach', 'elliptical,', 'imminent', 4]"
"profess,","She would often profess her undying love for him, despite their tumultuous relationship","He would profess his innocence in front of the jury, hoping to sway their decision",The politician would profess his commitment to improving healthcare for all citizens during his campaign speeches,"As a professor, she would often profess her passion for the subject matter to inspire her students",The cult leader would profess his divine connection and powers to gain followers' loyalty and devotion.,"['profess,', 'apocalypse', 'doctrinaire', 'elliptical,', 'magnate', 0]"
viable,The company is currently assessing various options to determine the most viable solution for expanding its operations,They are evaluating different strategies to determine which is the most viable in the current market conditions,It is essential to consider all factors to ensure a viable long-term plan for growth,"By conducting thorough research and analysis, they will be able to identify the most viable opportunities for success",It is crucial to make informed decisions based on viable data and projections to achieve sustainable growth.,"['conjure', 'equivocal', 'viable', 'gravity', 'unctuous', 2]"
sobriety,Maintaining sobriety is a significant achievement for individuals recovering from addiction,The journey towards sobriety requires dedication and perseverance,Living a life of sobriety can have a positive impact on one's physical and mental well-being,Support systems and therapy play a crucial role in maintaining sobriety long-term,Embracing sobriety can lead to a fulfilling and healthier lifestyle.,"['incisive', 'doctrinaire', 'injunction,', 'sobriety', 'decorous', 3]"
doctrinaire,The professor's doctrinaire approach to teaching limited the students' ability to think critically and engage in open discussion,His rigid adherence to a specific ideology stifled any room for alternative perspectives,The doctrinaire nature of his lectures left little room for creativity or independent thought,"Students often felt disheartened by the lack of flexibility in the classroom, leading to a sense of intellectual confinement","Despite his expertise in the subject matter, his doctrinaire teaching style failed to inspire a deeper understanding of the material.","['proximity', 'abate', 'irrevocable', 'doctrinaire', 'inert', 3]"
irrevocable,The decision to retire early was an irrevocable choice that brought a sense of freedom and uncertainty,She signed an irrevocable agreement that bound her to the terms and conditions of the contract,The words spoken in anger were irrevocable and left a lasting impact on their relationship,The irreversible changes made to the company's structure were deemed irrevocable by the board of directors,"Despite their attempts at reconciliation, the damage was deemed irrevocable, and they went their separate ways.","['irrevocable', 'discrete', 'profess,', 'sobriety', 'recant', 0]"
equivocal,"Her equivocal response to the proposal left everyone in the room puzzled, unsure of her true intentions",The CEO's equivocal statement regarding the company's future direction sparked uncertainty among the employees,"Despite the equivocal results of the experiment, the researchers were determined to find a conclusive answer","The politician's equivocal stance on the issue caused confusion among voters, leading to a decline in support","The lawyer's equivocal argument in court failed to persuade the jury, resulting in a verdict against their client.","['injunction,', 'coalesce', 'wistful', 'equivocal', 'equivocal', 3]"
"respite,","After a long and exhausting day at work, Sarah finally found a moment of respite when she arrived home",The warm cup of herbal tea offered a brief respite from the chilly weather outside,Taking a short walk in the park during her lunch break provided Sarah with a much-needed respite from the office environment,The peaceful sound of rain tapping against the window offered a soothing respite from the chaos of the city,"Sarah cherished these moments of respite, knowing they were essential for her well-being.","['egalitarian', 'respite,', 'fatuous', 'elliptical,', 'conventional', 1]"
empirical,Empirical evidence suggests that there is a clear correlation between exercise and mental health,Researchers have conducted numerous empirical studies to support their claims about the benefits of meditation,The scientific community relies heavily on empirical data to draw conclusions and make informed decisions,Empirical research has shown that individuals who consume a balanced diet are less likely to develop chronic diseases,"In academia, empirical studies are often cited as the foundation for building new theories and models.","['antecedent', 'hegemony', 'injunction,', 'quixotic', 'empirical', 4]"
languish,"As the days passed, the abandoned house continued to languish in disrepair, its once vibrant facade now faded and worn","The garden that used to be meticulously tended now lay overgrown and neglected, with flowers and plants languishing for care","Inside, the rooms were filled with silence, as memories of happier times languished in the dusty corners","The absence of human presence allowed a sense of desolation to linger, causing the entire property to languish in a state of melancholy","Despite its decline, there was a certain beauty in the way the house seemed to languish in time, frozen in a poignant stillness.","['revere', 'harbinger', 'extrovert', 'edify,', 'languish', 4]"
recant,"The witness decided to recant his earlier statement during the trial, causing a stir in the courtroom",The defendant's attorney urged the jury to consider the witness's recantation and its impact on the case,The judge reminded the jury that a recantation does not necessarily invalidate the original statement,"Despite the recantation, the prosecution presented additional evidence to support their case","The jury deliberated carefully, taking into account both the witness's recantation and the prosecution's evidence.","['quixotic', 'polarise', 'recant', 'languish', 'paradigm', 2]"
martyr,"The courageous activist willingly sacrificed their life for their beliefs and became a martyr for the cause, inspiring others to continue fighting for justice",The historical figure's martyrdom sparked a revolution that led to significant social change in the country,"The village celebrated the anniversary of the local martyr's death with a solemn ceremony, honoring their bravery and dedication","Throughout history, many martyrs have shown unwavering commitment to their principles, leaving behind a legacy of courage and conviction",The concept of martyrdom is often associated with selflessness and a willingness to endure suffering for a greater purpose.,"['vehement', 'edify,', 'martyr', 'static,', 'eminent', 2]"
relinquish,"She decided to relinquish her control over the project and allow her team to take the lead, trusting in their abilities to succeed","It was a difficult decision for her to relinquish the responsibility that she had carried for so long, but she knew it was necessary for growth","The decision to relinquish power was met with skepticism from some colleagues, who were uncertain about the change in leadership","Despite the challenges, she held firm in her choice to relinquish control and empower others to step up","As she watched her team flourish under their newfound autonomy, she felt a sense of pride in her decision to relinquish control.","['protract', 'quixotic', 'cogent', 'relinquish', 'egalitarian', 3]"
discrete,"In mathematics, a discrete variable refers to a distinct set of values that are separate and unique","The concept of discrete data contrasts with continuous data, which can take any value within a range",Researchers often analyze discrete variables to understand patterns and relationships in data points,"When conducting experiments, scientists may record discrete measurements to quantify specific attributes","Understanding the nature of discrete variables is crucial in various fields such as statistics, computer science, and engineering.","['static,', 'discrete', 'dissolution', 'harbinger', 'fidelity', 1]"
extrovert,"John, being the extrovert that he is, always thrives in social gatherings and enjoys meeting new people",His outgoing personality and friendly demeanor make it easy for him to strike up conversations and make connections,"Despite being an extrovert, he also values his alone time to recharge and reflect on his thoughts","In group settings, he often takes on the role of the life of the party, energizing those around him with his enthusiasm","Overall, being an extrovert brings John a sense of fulfillment and joy in his interactions with others.","['extrovert', 'effusion', 'fidelity', 'revere', 'prerogative', 0]"
"vocation,",Finding one's true vocation is a rewarding journey that often requires self-reflection and exploration of passions,Pursuing a vocation that aligns with one's values and skills can lead to a fulfilling career and sense of purpose,"Many people struggle to identify their vocation early in life, but it is never too late to make a career change and follow a different path","Society often emphasizes the importance of pursuing a vocation that is practical and lucrative, but it is equally important to choose a vocation that brings joy and fulfillment","Ultimately, honoring one's vocation allows for personal growth and a deeper connection to one's work.","['vocation,', 'inept', 'irrevocable', 'appropriate,', 'succinct', 0]"
"malign,","His actions were driven by a malign intent, as he sought to harm others for his own gain",The malign influence of negative thoughts clouded his judgment and led him down a destructive path,"Rumors spread about him were filled with malign lies and distortions, tarnishing his reputation unfairly","Despite facing constant malign criticism, he remained resilient and focused on proving his detractors wrong","In the face of such malign forces, he found solace in the unwavering support of true friends who stood by his side.","['viable', 'pristine', 'elliptical,', 'amenity', 'malign,', 4]"
vindicate,"Despite facing numerous accusations, she was determined to vindicate her reputation through undeniable evidence and support from trustworthy allies","As the truth slowly emerged, it became clear that she would ultimately vindicate her innocence and restore her good name",The relentless pursuit of justice by her legal team was crucial in vindicating her character and proving her detractors wrong,"Through her unwavering resolve and unwavering belief in the truth, she was able to vindicate herself and silence her critics","In the end, her perseverance paid off, and she emerged victorious, fully vindicated in the eyes of the public.","['vindicate', 'polarise', 'gratuitous', 'vindicate', 'vehement', 0]"
quixotic,"His quixotic dream of traveling the world on a bicycle seemed impractical at first, but he was determined to make it a reality","With an optimistic and adventurous spirit, he embarked on his quixotic journey, eager to explore new cultures and landscapes","Despite facing numerous challenges along the way, he remained steadfast in his quixotic quest, refusing to let obstacles deter him","Friends and family were initially skeptical of his quixotic plan, but as they saw his determination and passion, they began to support him wholeheartedly","In the end, his quixotic adventure not only fulfilled his own wanderlust but also inspired others to pursue their own seemingly impossible dreams.","['vindicate', 'revere', 'vocation,', 'inept', 'quixotic', 4]"
effusion,"Effusion of emotions is often seen as a sign of vulnerability, but it can also be a powerful form of self-expression",The effusion of grief at a funeral can bring a sense of closure and healing to those in mourning,"In literature, the effusion of words from a passionate character can captivate readers and evoke strong emotions",Some individuals struggle to control the effusion of thoughts that constantly race through their minds,The effusion of creativity in an artist's work can inspire and move others in profound ways.,"['conjure', 'manifesto', 'magnate', 'effusion', 'fatuous', 3]"
hegemony,"In the realm of international politics, hegemony refers to the dominance and influence exerted by a single state over others in a particular region",The United States has been accused of pursuing global hegemony through its military and economic power,"The concept of cultural hegemony, as proposed by Italian theorist Antonio Gramsci, highlights the subtle ways in which dominant ideologies shape societal norms and values","Hegemony can also be observed within social structures, where certain groups or individuals hold power and control over others",The rise and fall of hegemonic powers throughout history have often sparked conflict and resistance from those seeking to challenge the status quo.,"['hegemony', 'abate', 'callow', 'evanescent', 'respite,', 0]"
"static,","The radio emitted a constant buzz of static, making it hard to hear the music clearly","As the storm approached, the electricity in the air created a sense of heightened static energy",The static cling on the clothes was especially strong due to the dry weather,The television screen flickered with static before completely losing signal,The noise of static interference drowned out the voices on the other end of the phone call.,"['inert', 'antecedent', 'static,', 'conjure', 'respite,', 2]"
conventional,"In today's rapidly evolving world, the traditional notions of what is considered conventional are being challenged","Many people are moving away from conventional career paths and embracing new, unconventional ways of making a living",The rise of unconventional living arrangements and lifestyles is reshaping society's idea of what is normal or acceptable,"However, there are still those who prefer the stability and familiarity of conventional practices and traditions",Finding a balance between embracing change and clinging to conventional beliefs is a common struggle in our modern society.,"['bereaved', 'amenity', 'vindicate', 'evanescent', 'conventional', 4]"
maladroit,His maladroit attempts at juggling the delicate glassware resulted in a disastrous mess on the kitchen floor,"Despite his good intentions, his maladroit handling of the sensitive situation only made matters worse",She found it difficult to overlook his maladroit behavior during the important business meeting,The maladroit way he fumbled with the intricate knot only delayed the completion of the project,It was clear that his maladroit nature often caused more harm than good in various situations.,"['perfidy', 'maladroit', 'appropriate,', 'respite,', 'edify,', 1]"
"appropriate,",Choosing the appropriate outfit for a job interview can make a significant impact on the impression you make,It is important to use appropriate language and tone when communicating with colleagues and clients in a professional setting,Making an appropriate decision requires weighing all available options and considering the potential outcomes,It's essential to ensure that your actions are appropriate for the situation and align with your values and beliefs,"When faced with a dilemma, it's crucial to seek guidance from someone with appropriate expertise or experience.","['vehement', 'appropriate,', 'injunction,', 'harbinger', 'protagonist,', 1]"
prerogative,It is within the president's prerogative to issue executive orders that shape policy decisions,"As a manager, it is your prerogative to assign tasks to your team members based on their skills and expertise","In a democratic society, voting is seen as a fundamental prerogative of every citizen",The owner of the company has the prerogative to make key strategic decisions that impact the business,"As an individual, it is your prerogative to choose how to spend your free time and pursue your interests.","['inert', 'succinct', 'irrevocable', 'prerogative', 'eminent', 3]"
incisive,"Her incisive analysis cut through the complexity of the issue, providing a clear path forward","With her incisive wit, she effortlessly disarmed any opposition in the room",The incisive questions she posed during the meeting uncovered critical flaws in the project plan,"Known for her incisive observations, she was always sought after for feedback and advice",The CEO's incisive decision-making skills led the company to unprecedented success.,"['harbinger', 'viable', 'incisive', 'vehement', 'respite,', 2]"
revere,The villagers revere the village elder for his wisdom and guidance during difficult times,"They gather around him, eager to learn from his experiences and stories","His words are always listened to with attentiveness and respect, as his reputation as a revered leader precedes him","The children look up to him with admiration, aspiring to one day be as respected and esteemed as he is","The people of the village feel privileged to have such a revered figure amongst them, serving as a source of inspiration and strength for the community.","['appropriate,', 'quixotic', 'tenuous', 'abate', 'revere', 4]"
transgress,The teacher warned the students not to transgress the boundaries of the school's code of conduct,"Despite the clear rules in place, some students continued to transgress and disrupt the learning environment",The consequences for those who transgressed ranged from warnings to suspension,It was important for everyone to understand the severity of their actions when they chose to transgress the rules,"By educating students on the reasons for the rules and the potential impact of their transgressions, the school hoped to reduce incidents of misbehavior.","['futile', 'injunction,', 'profess,', 'transgress', 'decorous', 3]"
vehement,Her vehement opposition to the proposal was evident in her raised voice and stern demeanor during the meeting,"Despite the heated discussion, she remained steadfast in her vehement objections, refusing to back down","The team members were taken aback by her strong and vehement reaction to their suggestions, causing tension in the room",Her vehement advocacy for social justice issues inspired others to join her in the fight for equality and fairness,"In the end, her decision to speak out with such vehement passion left a lasting impression on those around her.","['doctrinaire', 'fidelity', 'acute', 'hegemony', 'vehement', 4]"
conjure,"She stood before the ancient altar and closed her eyes, focusing all her energy on the spell she was about to cast","With a wave of her hand, she began to conjure the elements, calling forth fire and water to respond to her will","As the incantation rose from her lips, a mystical energy filled the room, swirling and dancing around her in a mesmerizing display","The air crackled with magic as she continued to conjure with a fierce determination, her heart pounding with anticipation","Finally, as the last words left her mouth, a burst of light exploded from the altar, revealing the manifestation of her conjured creation.","['extrovert', 'conjure', 'imminent', 'profess,', 'vindicate', 1]"
malinger,The employee was suspected of trying to malinger by faking sickness to get out of work early,The manager noticed a pattern of malingered absences whenever there was a big project deadline approaching,"Despite the employee's attempts to malinger, their behavior was eventually discovered and dealt with accordingly",The company implemented stricter policies to prevent employees from malinger and maintain a productive work environment,"Malingered behavior can have serious consequences in a professional setting, such as loss of trust and potential disciplinary actions.","['succumb', 'inept', 'fidelity', 'malinger', 'callow', 3]"
cogent,Her cogent arguments during the debate left the audience impressed with her persuasiveness and clarity of thought,The professor's cogent analysis of the financial market provided valuable insights for the students,The CEO presented a cogent strategy for the company's growth that received unanimous support from the board members,The lawyer's cogent reasoning in court helped sway the jury in favor of the defendant,"In academic circles, her cogent research on climate change has been widely recognized and praised for its thoroughness.","['broach', 'vocation,', 'appropriate,', 'doctrinaire', 'cogent', 4]"
awry,"The meticulously planned project took a turn for the worse when key team members fell ill, sending everything awry",The timeline for completion went awry due to unexpected delays in the supply chain,"Despite the precautions taken, the experiment went awry, leaving the scientists puzzled",The financial forecast went awry as the market conditions shifted unexpectedly,The carefully crafted surprise party for her birthday went awry when she found out about it beforehand.,"['amenity', 'abate', 'awry', 'decorous', 'conventional', 2]"
"protagonist,","The protagonist of the story is a young detective named Alex, who is determined to solve the mysterious case","As the protagonist uncovers more clues, it becomes apparent that there are multiple suspects involved in the crime","Throughout the novel, the protagonist encounters various obstacles and challenges that test their resolve","Despite facing setbacks, the protagonist's determination and resilience propel them forward in their quest for the truth","Ultimately, the protagonist's unwavering dedication leads to a surprising revelation that changes everything.","['agnostic,', 'infinitesimal,', 'perfidy', 'incisive', 'protagonist,', 4]"
pristine,"The morning sunlight illuminated the landscape, revealing a pristine lake nestled amongst towering trees","The water sparkled with a pristine clarity, inviting you to take a refreshing swim","As you walked along the pristine shoreline, the gentle breeze carried the scent of wildflowers",The serene atmosphere of the pristine wilderness filled you with a sense of peace and tranquility,"In that moment, you felt grateful for the untouched beauty of the pristine surroundings.","['magnate', 'pristine', 'injunction,', 'succumb', 'proximity', 1]"
