word,sentence1,sentence2,sentence3,sentence4,sentence5,option_result
"lampoon,","The comedy show featured a witty lampoon of current political trends, eliciting uproarious laughter from the audience",The satirical cartoonist never shied away from lampooning famous politicians and celebrities in his work,"Despite the controversial nature of his lampooning style, he gained a loyal following for his sharp wit and clever criticisms",The magazine's lampoon of the fashion industry's obsession with luxury brands was both hilarious and thought-provoking,The comedian's lampoon of societal norms and taboos pushed boundaries and challenged audience members to think differently about social issues.,"['pivotal,', 'vex', 'facetious', 'lampoon,', 'cognitive', 3]"
"proselytise,",Proselytise refers to the act of attempting to convert someone from one belief or religion to another,Some people believe it is important to proselytise in order to share their faith with others,"However, others view proselytising as intrusive or disrespectful","In some cultures, proselytising is seen as a way to spread positivity and enlightenment","Ultimately, the decision to proselytise is a personal choice that varies greatly among individuals and communities.","['ingenuous', 'proselytise,', ',promulgate,', 'transient', 'plethora', 1]"
morose,"Sarah woke up feeling morose, a heaviness in her heart that she couldn't shake","The gray clouds outside seemed to mirror her somber mood, casting a gloomy shadow over the day",Her usually cheerful demeanor was replaced by a sense of melancholy as she went about her daily routine,"Even her favorite song failed to brighten her spirits, the lyrics now sounding morose and forlorn","As the day wore on, Sarah found herself retreating further into her morose thoughts, unable to find solace in anything around her.","['salient', 'abridge', 'narcissism', 'morose', 'caricature', 3]"
caricature,"The artist sketched a hilarious caricature of the politician, capturing his oversized ears and signature grin perfectly","The caricature was a hit at the party, eliciting laughter and applause from the guests","In the caricature, the artist exaggerated the subject's features to create a comical and exaggerated likeness",Creating caricatures requires keen observation and a skillful hand to highlight and distort specific characteristics,"The cartoonist's caricature of the CEO was both funny and flattering, showcasing his sense of humor and creativity.","['caricature', 'peripatetic', 'ingenuous', 'auspicious,', 'integral', 0]"
exacting,"The professor was known for setting exacting standards for his students, demanding precision and accuracy in their work",Meeting his exacting expectations required dedication and attention to detail,"Some students found his approach to be daunting, but others appreciated the challenge","Despite the challenging nature of his assignments, students often emerged from his class with a deepened understanding of the subject matter","Overall, the professor's exacting methods were seen as beneficial in pushing students to strive for excellence.","['prepossess', 'vitriolic', 'exacting', 'servile', 'salient', 2]"
"comprise,","The new sports complex will comprise a state-of-the-art gymnasium, swimming pool, basketball court, and tennis courts",The committee decided that the task force would comprise representatives from each department within the organization,The encyclopedia set will comprise volumes covering various topics from history to science,"The new housing development will comprise single-family homes, townhouses, and apartment buildings","The dessert menu will comprise a selection of cakes, pies, and ice cream flavors.","['mercenary', 'comprise,', 'lampoon,', 'comprise,', 'rogue', 1]"
degenerate,"The degenerate behavior exhibited by some members of the community was alarming, leading to concerns about the overall moral fabric of the society","Despite efforts to address the issue, the degenerate nature of the criminal activities persisted, posing a challenge for law enforcement authorities",The degenerate state of the economy was a result of years of mismanagement and corruption at the highest levels of government,It became clear that the degenerate mindset of certain individuals was hindering progress and development in the region,The degenerate values promoted by some influential figures were contributing to a sense of moral decay in the community.,"['degenerate', 'salient', 'degenerate', 'vex', 'milieu', 0]"
hedonism,Hedonism is a philosophical idea that emphasizes pleasure and the pursuit of happiness as the highest good in life,Some people associate hedonism with a lifestyle of indulgence and self-gratification without much regard for consequences,"While hedonism can lead to temporary enjoyment, it may also result in long-term dissatisfaction and emptiness",It is important to find a balance between seeking pleasure and pursuing meaningful experiences to avoid falling into the trap of hedonism,"Ultimately, true fulfillment may come from a combination of pleasure, personal growth, and connections with others rather than solely focusing on hedonistic pursuits.","['hedonism', 'latent', 'portent', 'servile', 'congenial', 0]"
agenda,"Sure, here is a paragraph with the word 'agenda' mentioned five times: As we kick off today's meeting, let's review the agenda to ensure we stay on track",It's important that everyone is aware of the agenda items and their respective deadlines,We must prioritize the tasks on the agenda in order to meet our goals for this quarter,Let's stick to the agenda and make efficient use of our time during this meeting,"By following the agenda closely, we can address all the key points and take steps toward achieving our objectives.","['inaugurate', 'agenda', 'ingenuous', ',promulgate,', 'cacophony', 1]"
cacophony,The concert hall was filled with a cacophony of sounds as the orchestra tuned their instruments,"Among the cacophony of voices in the busy marketplace, the vendor's calls stood out","As the thunderstorm raged outside, the cacophony of raindrops against the window created a soothing rhythm","Walking through the bustling city streets, the cacophony of cars honking and people chatting filled the air","Despite the cacophony of opinions in the meeting, a decision was finally reached through compromise and collaboration.","['bourgeois', 'propensity', 'auspicious,', 'abridge', 'cacophony', 4]"
vitriolic,"Her vitriolic comments towards her coworkers were both shocking and hurtful, leaving a tense atmosphere in the office","Despite attempts to diffuse the situation, her vitriolic tone persisted, causing further discord",The vitriolic nature of her words revealed the deep-seated animosity she harbored towards her colleagues,"Colleagues were taken aback by the sudden outburst of vitriolic remarks, unsure of what prompted such venomous behavior","The vitriolic exchange that ensued highlighted the toxic dynamics within the team, making it difficult to foster a positive work environment.","['sublime,', 'vitriolic', 'confluence', 'avuncular,', 'vitriolic', 1]"
ardent,"He was known for his ardent dedication to environmental conservation, spending countless hours volunteering at local wildlife sanctuaries",Her ardent love for literature was evident in the way she passionately discussed her favorite books with anyone who would listen,"The singer's ardent fans waited outside the venue for hours, eagerly anticipating her upcoming performance","Despite facing criticism, she remained ardent in her beliefs and continued to advocate for social justice causes",The young artist's ardent desire to succeed in the music industry kept her motivated to practice and improve her craft every day.,"['ingenuous', 'catharsis', 'ardent', 'cacophony', 'depravity', 2]"
prepossess,"She had a prepossessing demeanor that made her instantly likable in any social setting, effortlessly capturing the attention of those around her","Her prepossessing smile could brighten even the gloomiest of days, spreading warmth and joy to all who crossed her path","Despite her prepossessing appearance, she remained humble and approachable, never allowing her beauty to overshadow her kind heart","People were naturally drawn to her prepossessing charisma and magnetic personality, making her a natural leader in any group","Her prepossessing charm and grace made her a beloved figure in the community, admired and respected by all who knew her.","['abridge', 'prepossess', 'hedonism', 'antithesis', 'rogue', 1]"
platitude,"While some may dismiss his speech as filled with platitudes, others found comfort in his familiar words",The use of platitudes can sometimes be a politician's way of avoiding controversial topics,It is important to be mindful of relying on platitudes when addressing complex issues that require thoughtful consideration,Critics argue that platitudes are empty expressions that lack depth or substance,"Despite the criticism, platitudes continue to be a common rhetorical device used in various forms of communication.","['platitude', 'litigate', 'ardent', 'bourgeois', 'pivotal,', 0]"
gregarious,"She was known for being the life of the party, always effortlessly drawing people towards her with her gregarious personality","Her gregarious nature made her a natural leader amongst her friends, always putting others at ease with her warmth and charm","At social gatherings, she would light up the room with her gregarious laughter and infectious energy","Despite her busy schedule, she always made time for her friends, showcasing her gregarious spirit in every interaction","It was no surprise that she was seen as the most gregarious member of her social circle, always radiating positivity wherever she went.","['peripatetic', 'relentless', 'gregarious', 'cognitive', 'servile', 2]"
admonish,It is important for parents to admonish their children when they misbehave in order to instill discipline,The teacher had to admonish the students for talking during the test,The boss would frequently admonish employees for being late to work,The coach felt it was necessary to admonish the players for their lack of teamwork on the field,The supervisor had to admonish the employee for violating company policies.,"['propensity', 'distend,', 'inaugurate', 'vitriolic', 'admonish', 4]"
"insular,","The insular community on the remote island had a strong sense of unity and tradition, often viewed as being disconnected from the outside world","Their insular mindset made them hesitant to welcome newcomers or new ideas, preferring to preserve their way of life","Despite their insular nature, the islanders had a deep respect for their elders and the wisdom passed down through generations","The insular environment fostered a unique cultural identity that was evident in their art, music, and customs","While some outsiders viewed the insular community as closed-off, others admired their commitment to preserving their heritage.","['prepossess', 'narcissism', 'servile', 'cognitive', 'insular,', 4]"
"auspicious,","The auspicious event was marked by clear skies and a gentle breeze, setting the perfect atmosphere for celebration","Guests arrived with smiles on their faces, bringing with them a sense of joy and anticipation for the day ahead","As the ceremony began, the auspicious moment when the couple exchanged vows was met with tears of happiness from the audience","The auspicious occasion continued into the evening, with laughter and music filling the air, creating memories that would last a lifetime","It was truly an auspicious day, filled with love, laughter, and a feeling of hope for the future.","['peripatetic', 'bastion,', 'propensity', 'auspicious,', 'machination', 3]"
consummate,"He was a consummate professional, always striving for perfection in his work",Her consummate skills and experience made her the ideal candidate for the job,Their friendship was a consummate example of loyalty and trust,The chef's consummate ability to create exquisite dishes impressed everyone who dined at his restaurant,"With consummate grace and elegance, she captivated the audience with her performance.","['tacit', 'consummate', 'squalor', 'morose', 'propensity', 1]"
"defame,",The tabloid article aimed to defame the actress by spreading false rumors about her personal life,The malicious comments on social media were intended to defame the politician and tarnish his reputation,It is illegal for someone to defame another person by making slanderous statements with the intent to harm their character,The company threatened to sue anyone who attempted to defame their brand through false allegations,The journalist faced consequences for attempting to defame a public figure without any evidence to support their claims.,"['consummate', 'chronic', 'defame,', 'comprise,', 'flout', 2]"
latent,"Her latent talent for painting emerged unexpectedly during a summer art class, surprising even herself with the depth of her creativity","Despite years of neglect, there remained a latent passion for music buried deep within his heart, waiting to be reignited",The latent potential of the small startup company attracted the attention of investors looking for hidden gems in the business world,"Unbeknownst to her, there was a latent fear of failure lurking beneath her confident exterior, hindering her from taking risks","As the sun set on the horizon, the latent beauty of the landscape was revealed in a breathtaking display of colors.","['portent', 'chronic', 'servile', 'latent', 'admonish', 3]"
altruism,"Altruism is the selfless concern for the well-being of others, often demonstrated through acts of kindness and generosity","People who exhibit altruism prioritize the needs of others above their own, showing compassion and empathy in their interactions",It is believed that altruism plays a key role in fostering strong and positive relationships within communities,"Acts of altruism can have a ripple effect, inspiring others to also engage in kind deeds and contribute to a more harmonious society",Cultivating a spirit of altruism can lead to a greater sense of fulfillment and purpose in one's life.,"['agenda', 'altruism', 'squalor', 'lampoon,', 'vitiate', 1]"
depravity,"The depravity of his actions shocked the entire community, leaving them reeling in disbelief",The depths of depravity to which some individuals can sink is truly unsettling,"Society grapples with the constant exposure to depravity in the media, desensitizing many to its impact","Despite the depravity surrounding him, he remained steadfast in his moral convictions",It is a sad reality that we must confront the depravity that exists in the world and work towards a more compassionate society.,"['inaugurate', 'burlesque', 'defame,', 'vitiate', 'depravity', 4]"
intrinsic,The intrinsic value of art lies in its ability to evoke emotions and spark meaningful conversations,"Each artist brings their own intrinsic style and perspective to their creations, making each piece truly unique",It is important to recognize and appreciate the intrinsic qualities of individuals as a way to foster unity and understanding in society,"When we focus on developing our intrinsic motivation and passions, we are more likely to find fulfillment and purpose in our endeavors",Cultivating a sense of intrinsic worth and self-acceptance can lead to a greater sense of confidence and happiness in life.,"['intrinsic', 'comprise,', 'consummate', 'abridge', 'latent', 0]"
relentless,"His relentless pursuit of excellence propelled him to the top of his field, earning him recognition and respect from his peers","Despite facing numerous obstacles along the way, he remained relentless in his dedication to achieving his goals",His relentless work ethic and determination inspired those around him to strive for greatness as well,"Even in the face of adversity, he maintained a relentless attitude, never allowing setbacks to deter him from his path",The relentless passion he displayed for his craft set him apart as a true master in his field.,"['relentless', 'chronic', 'prepossess', 'superfluous', 'agenda', 0]"
burlesque,"Burlesque is a form of entertainment that dates back to the 19th century, characterized by comedic and often risqué performances","The burlesque show featured elaborate costumes, satirical skits, and playful dance routines",Audiences would flock to burlesque theaters to enjoy the lively and provocative performances,Many famous actresses got their start in burlesque before transitioning to more mainstream roles in Hollywood,"Today, burlesque has experienced a revival with modern twists on the classic art form.","['bastion,', 'depravity', 'cacophony', 'tacit', 'burlesque', 4]"
tentative,She felt a sense of tentative excitement as she prepared for the job interview,"The candidate made a tentative suggestion during the team meeting, unsure of how it would be received","The project timeline was still in a tentative stage, with many details yet to be finalized","The group proceeded with a tentative plan, making adjustments along the way based on feedback and new information","Despite the tentative nature of their approach, they remained optimistic about reaching their goals.","['machination', 'altruism', 'tentative', 'vilify', 'abhor,', 2]"
catharsis,Catharsis is the release of pent-up emotions and tension through a form of art or expression,Many people find catharsis in journaling their thoughts and feelings as a way to process and release them,Watching a heartwrenching movie can provide a cathartic experience by allowing viewers to empathize with the characters' struggles,Engaging in physical activities like running or dancing can also offer catharsis by channeling energy and emotions into movement,It's important to find healthy outlets for catharsis to promote emotional well-being and inner peace.,"['integral', 'itinerant', 'catharsis', 'servile', 'depravity', 2]"
plethora,"The library had a plethora of books on a wide range of topics, from ancient history to modern science",Students were often overwhelmed by the plethora of options available for their research projects,"The bookstore offered a plethora of magazines catering to various interests, from fashion to sports",The art gallery showcased a plethora of paintings and sculptures by both established and emerging artists,"The buffet restaurant boasted a plethora of dishes, ensuring that there was something for everyone to enjoy.","['sublime,', 'proselytise,', 'plethora', 'cognitive', 'facetious', 2]"
stymie,The unexpected delay in receiving the necessary permits threatened to stymie the construction of the new office building,"Despite their best efforts, the team encountered numerous obstacles that seemed to stymie their progress at every turn",The complex algorithms implemented in the new software program were designed to stymie potential security breaches,The lack of available resources continued to stymie the completion of the ambitious project,The ongoing dispute between the two parties has only served to stymie any potential collaboration.,"['lampoon,', 'vex', 'ingenuous', 'scrutinise', 'stymie', 4]"
bourgeois,"The bourgeoisie, or bourgeois class, typically refers to the middle class in society","In many Western countries, the bourgeois lifestyle is associated with values such as material wealth and social status",Some critics argue that the bourgeoisie is out of touch with the struggles of the working class,The term bourgeois is often used pejoratively to describe individuals who prioritize their own comfort and luxury over social justice issues,"Despite criticisms, the bourgeois mindset continues to shape our modern economy and culture.","['defame,', 'lampoon,', 'vitiate', 'rogue', 'bourgeois', 4]"
conciliatory,"In an attempt to resolve the conflict, she adopted a conciliatory tone with her coworkers","Her conciliatory gestures were met with skepticism initially, but slowly began to make a positive impact",The conciliatory approach helped in fostering better communication and understanding among the team members,"Despite facing resistance at first, she remained steadfast in her conciliatory efforts","Eventually, her conciliatory actions led to a peaceful resolution and improved relationships within the team.","['tacit', 'integral', 'confluence', 'propitious', 'conciliatory', 4]"
"pivotal,","Last year's company retreat was a pivotal moment for our team, leading to stronger collaboration and clearer goals",The pivotal decision to invest in new technology helped us stay ahead of our competitors in the market,Our CEO's speech at the conference was a pivotal point in inspiring the team to work towards a common vision,"As we approached the pivotal stage of product development, our team worked tirelessly to meet the deadline",The pivotal partnership with a key supplier ensured we had access to essential resources for our project's success.,"['demagogue,', ',promulgate,', 'ideology', 'morose', 'pivotal,', 4]"
"demagogue,","The demagogue incited the crowd with inflammatory rhetoric, appealing to their deepest fears and prejudices","Despite lacking substantial policy proposals, the demagogue was skilled at manipulating emotions and spreading propaganda","Many were drawn to the demagogue's charisma and powerful presence, overlooking the dangers of his divisive tactics",The demagogue's speeches often contained thinly veiled threats and promises of authoritarian actions,History serves as a warning of the havoc that can be wrought by demagogues who exploit the vulnerabilities of society.,"['milieu', 'morose', 'demagogue,', 'plethora', 'caricature', 2]"
salient,"The keynote speaker emphasized the most salient points of the research findings, capturing the audience's attention with his clear insights","The salient features of the new product were its innovative design and user-friendly interface, setting it apart from competitors in the market","As I read through the report, the most salient issue that stood out to me was the need for improved communication within the team","The project manager highlighted the salient risks that could impact the timeline and budget of the project, prompting a thorough risk mitigation plan to be developed","In conclusion, it is essential to address the salient issues first in order to achieve successful outcomes and meet project objectives effectively.","['depravity', 'ardent', 'salient', 'abridge', 'distend,', 2]"
rogue,"Amidst the chaos that ensued, the rogue agent slipped away unnoticed, blending into the bustling crowd with ease","Whispers of a rogue hacker wreaking havoc on the city's cyber networks spread like wildfire, causing panic among the residents",The authorities scrambled to track down the rogue individual responsible for the recent string of daring heists that left the city on edge,"With each passing day, the mysterious rogue figure became more elusive, leaving behind a trail of confusion and fear","As tension mounted, a task force was assembled to hunt down the rogue elements threatening the stability of the city.","['rogue', 'sublime,', 'rogue', 'glut', 'vitriolic', 0]"
",promulgate,",The government agency plans to promulgate new regulations regarding environmental protection,They believe that these regulations will help reduce pollution levels and promote sustainable practices,"Before they can promulgate the rules, they must seek feedback from stakeholders and conduct thorough research","Once the regulations are promulgated, businesses will be required to comply in order to operate within the legal framework",It is crucial for the agency to effectively promulgate the regulations to ensure widespread understanding and compliance.,"[',promulgate,', 'glut', 'plethora', 'caricature', 'inaugurate', 0]"
fauna,"The national park is known for its diverse fauna, ranging from small mammals to majestic birds of prey","Visitors can spot a variety of fauna while hiking along the trails, such as deer, foxes, and colorful butterflies",The conservation efforts in this area have helped protect the native fauna and their habitats from encroaching development,Researchers study the behavior of the local fauna to better understand their ecological roles within the ecosystem,It's fascinating to observe the interactions between different species of fauna in their natural environment.,"['fauna', 'portent', 'salient', 'gregarious', 'inaugurate', 0]"
onerous,The onerous task of completing a 50-page report by tomorrow is weighing heavily on Sarah's mind,She finds the work to be particularly onerous because of the tight deadline and complex information involved,"Despite the onerous nature of the project, Sarah is determined to see it through and deliver a high-quality result",Her colleagues sympathize with her as they understand the onerous burden she is under,"Sarah's dedication to her tasks, no matter how onerous, is admirable and inspires others in the office.","['onerous', 'auspicious,', 'rogue', 'mercenary', 'morose', 0]"
cognitive,Cognitive processes play a crucial role in shaping our understanding of the world around us,"As we age, our cognitive abilities may decline, impacting our memory and decision-making skills","Engaging in activities that challenge our cognitive functions, such as puzzles or learning a new language, can help maintain mental sharpness","Cognitive therapy is often used to address issues related to mental health, such as depression or anxiety",Researchers continue to explore the intricate workings of the cognitive system to unlock its full potential.,"['servile', 'altruism', 'fauna', 'sublime,', 'cognitive', 4]"
